2024_GMC_36685_1,GER/ CE/1806/2019/Part-D/09 Dated 26/02/2024,Repairing and Renovation of Arohan Path near residence of SK Chand Mahammad new Sarania,Repairing and Renovation of Arohan Path near residence of SK Chand Mahammad new Sarania,Works,Open Tender,Lump-sum,Civil Works - Others,No,No,NA ,27-Feb-2024 02:00 PM,NA ,180.0,No ,No,Online,14-Mar-2024 03:00 PM,Guwahati Municipal Corporation,GUWAHATI,781006.0,2.0,"15,00,000",BHASKAR JYOTI DEKA,"1,204,500",Accepted-AOC,20-Nov-2024,Guwahati Municipal Corporation,"The tender is for repairing and renovation of Arohan Path near the residence of SK Chand Mahammad in new Sarania. The description does not mention any flood-related keywords or context, such as flood protection, embankment construction, or drainage systems. The tender also does not specify any temporal factors like pre-monsoon preparation or post-flood restoration. Based on the information provided, this appears to be a routine road maintenance and repair project, rather than a flood-related infrastructure work.",Non-Flood,success,
2024_GMC_37293_1,GER/MSWM(P)/58/2023/279 Dated_14_03_2024,"CONSTRUCTION OF MSW REFUSE TRANSFER STATION WITH SUPPLY, INSTALLATION, TESTING AND COMMISSIONING OF MACHINERIES / EQUIPMENTS INCLUSIVE OF ANNUAL MAINTENANCE CONTRACT FOR 05 YEARS FOR GUWAHATI MUNICIPAL CORPORATION AT PURABI DAIRY","CONSTRUCTION OF MSW REFUSE TRANSFER STATION WITH SUPPLY, INSTALLATION, TESTING AND COMMISSIONING OF MACHINERIES / EQUIPMENTS INCLUSIVE OF ANNUAL MAINTENANCE CONTRACT FOR 05 YEARS FOR GUWAHATI MUNICIPAL CORPORATION AT PURABI DAIRY",Works,Open Tender,Lump-sum,Civil Works,No,No,NA ,15-Mar-2024 11:00 AM,27-Mar-2024 02:00 PM ,180.0,No ,No,Online,02-May-2024 02:30 PM,Guwahati Municipal Corporation,Guwahati,781006.0,2.0,,Priyashi Aashi Developers Pvt. Ltd.,"68,834,181",Rejected-AOC,15-Nov-2024,Guwahati Municipal Corporation,"The tender is for the construction of a municipal solid waste (MSW) refuse transfer station, including the supply, installation, testing, and commissioning of machinery and equipment, as well as a 5-year annual maintenance contract. The project is being undertaken by the Guwahati Municipal Corporation, which is a local government agency responsible for urban infrastructure and services.

While the tender mentions the construction of a refuse transfer station, it does not appear to have any direct connection to flood-related infrastructure or flood management. The project scope is focused on waste management and does not include any specific flood protection, prevention, or mitigation measures. There are no flood-related keywords or context mentioned in the tender details.

Additionally, the tender does not provide any information about the project's timing or urgency, which could indicate a potential flood-related context. The lack of seasonal or temporal factors related to flooding further suggests that this is a regular infrastructure development project, rather than a flood-related one.",Non-Flood,success,
2024_GMC_37993_7,GMC/SBM/03/2024/159 Dated_12/07/2024,"Door to Door Collection and Transportation of Municipal Waste in Package 7- Wards Covered-53,54,55 and 37","Door to Door Collection and Transportation of Municipal Waste in Package 7- Wards Covered-53,54,55 and 37",Services,Open Tender,Lump-sum,Miscellaneous Services,No,No,NA ,15-Jul-2024 10:00 AM,20-Jul-2024 02:00 PM ,180.0,No ,No,Online,30-Aug-2024 02:30 PM,Guwahati Municipal Corporation,Guwahati,781006.0,1.0,,RUNUMI GOGOI,15.0,Accepted-AOC,29-Nov-2024,Guwahati Municipal Corporation,"The tender is for door-to-door collection and transportation of municipal waste in specific wards of Guwahati. It does not mention any flood-related works, infrastructure, or emergency response. The tender is also not specifically timed for pre-monsoon or post-flood activities. Based on the information provided, this tender appears to be for routine municipal waste management services and does not have a primary focus on flood-related activities.",Non-Flood,success,
2024_GMC_38401_1,GER/Div-V/100/2023/13 Dated 06/08/2024,Construction of retaining wall and road near Balaji Temple,Construction of retaining wall and road near Balaji Temple,Works,Open Tender,Lump-sum,Civil Works - Others,No,No,NA ,09-Aug-2024 02:00 PM,NA ,180.0,No ,No,Online,29-Aug-2024 03:00 PM,Guwahati Municipal Corporation,GUWAHATI,781006.0,2.0,"86,87,000",P.S. ENTERPRISE,"6,702,020.5",Rejected-AOC,06-Nov-2024,Guwahati Municipal Corporation,"The tender is for the construction of a retaining wall and a road near the Balaji Temple, which is a regular infrastructure development project. While the location near a temple may suggest the possibility of flood-prone areas, the tender does not explicitly mention any flood-related aspects, such as flood protection, prevention, or mitigation measures. The description and department (Guwahati Municipal Corporation) indicate that this is a standard construction project, rather than a specialized flood-related infrastructure work. There are no clear flood-related keywords or temporal factors (such as pre-monsoon preparation) that would suggest this is a flood-related project.",Non-Flood,success,
2024_GMC_38840_7,GER/CE/2430/2024/8 Dated 03/09/2024,Storm water drain at Birkuchi Bihogee Nagar foothill area. Part-A,Storm water drain at Birkuchi Bihogee Nagar foothill area. Part-A,Works,Open Tender,Lump-sum,Civil Works,No,No,NA ,05-Sep-2024 02:00 PM,NA ,180.0,No ,No,Online,09-Oct-2024 03:00 PM,Guwahati Municipal Corporation,GUWAHATI,781006.0,2.0,"62,50,000",Build Zone,"6,250,000",Rejected-Technical,22-Nov-2024,Guwahati Municipal Corporation,"The tender is for the construction of a storm water drain in the Birkuchi Bihogee Nagar foothill area, which is a flood-prone region. The description explicitly mentions ""storm water drain"", indicating that the primary purpose of this project is to improve drainage and flood mitigation in the area. This aligns with the primary indicators for flood-related infrastructure projects. Additionally, the location being a foothill area suggests the project is aimed at addressing flood-related issues in the region.",Flood,success,
2024_GMC_38840_8,GER/CE/2430/2024/8 Dated 03/09/2024,Storm water drain at Birkuchi Bihogee Nagar foothill area. Part-B,Storm water drain at Birkuchi Bihogee Nagar foothill area. Part-B,Works,Open Tender,Lump-sum,Civil Works,No,No,NA ,05-Sep-2024 02:00 PM,NA ,180.0,No ,No,Online,09-Oct-2024 03:00 PM,Guwahati Municipal Corporation,GUWAHATI,781006.0,2.0,"62,50,000",K D Infra,"6,250,000",Not Admitted-Fee/PreQual/Technical,18-Nov-2024,Guwahati Municipal Corporation,"The tender is for a storm water drain project in the Birkuchi Bihogee Nagar foothill area, which is likely a flood-prone region. The description explicitly mentions ""storm water drain"", indicating the primary purpose is flood prevention and drainage management. The project is being undertaken by the Guwahati Municipal Corporation, a local government body responsible for urban infrastructure, suggesting this is a flood-related infrastructure development work.",Flood,success,
2024_HB_37967_1,Tender No. PRI.431440/Z-3 Date 10-7-2024,"Supply of Dietary articles under the Zone-3 Jails, Group-C for the year 2024-25","Supply of Dietary articles under the Zone-3 Jails, Group-C for the year 2024-25",Goods,Open Tender,Supply,Food Products,No,No,NA ,11-Jul-2024 06:45 PM,15-Jul-2024 03:00 PM ,365.0,No ,No,Online,25-Jul-2024 03:00 PM,Home B||Assam Prison Headquarters,as per bid document,781022.0,2.0,,LAKSHMI RATAN ENTERPRISE,"3,132,000",Rejected-Technical,02-Nov-2024,Home B||Assam Prison Headquarters,"The tender is for the supply of dietary articles for jails under Zone-3 in Assam. It does not mention any flood-related works, infrastructure, or emergency response. The department involved is the Home Department and Assam Prison Headquarters, which are not typically associated with flood management. There are no keywords or context indicating this is a flood-related project. The tender appears to be for routine procurement of supplies for the prison system, without any specific flood mitigation or prevention purpose.",Non-Flood,success,
2024_HB_37970_1,Tender No. PRI.431440/Z-3 Date 10-7-2024,"Supply of Dietary articles under the Zone-3 Jails, Group-D for the year 2024-25","Supply of Dietary articles under the Zone-3 Jails, Group-D for the year 2024-25",Goods,Open Tender,Supply,Food Products,No,No,NA ,11-Jul-2024 06:55 PM,15-Jul-2024 03:00 PM ,365.0,No ,No,Online,25-Jul-2024 03:00 PM,Home B||Assam Prison Headquarters,as per bid document,781022.0,2.0,,UMA PRASAD UPADHYA,"6,966,000",Rejected-Technical,02-Nov-2024,Home B||Assam Prison Headquarters,"The tender is for the supply of dietary articles for jails under Zone-3 in Assam. It does not mention any flood-related works, infrastructure, or emergency response. The department involved is the Home Department and Assam Prison Headquarters, which are not typically associated with flood management. There are no keywords or context indicating this is a flood-related project. The tender appears to be for routine procurement of supplies for the prison system, without any specific flood mitigation or prevention purpose.",Non-Flood,success,
2024_HE_40427_2,SSMB/DBT/2024/T-042,Services for Bioinformatic Analysis of Ligand-Protein Interaction,Services for Bioinformatic Analysis of Ligand-Protein Interaction,Services,Open Tender,Works,Infotech Services,No,No,NA ,19-Nov-2024 11:25 AM,NA ,30.0,No ,No,Online,26-Nov-2024 11:35 AM,Department of Higher Education||Directorate of Higher Education||Swahid Smriti Mahavidyalaya,"Nalbari, Belsor",781304.0,2.0,,AGT BIOSCIENCES (OPC) PRIVATE LIMITED,"20,650",Accepted-AOC,28-Nov-2024,Department of Higher Education||Directorate of Higher Education||Swahid Smriti Mahavidyalaya,"The tender is for ""Services for Bioinformatic Analysis of Ligand-Protein Interaction"", which is a bioinformatics project focused on analyzing the interaction between ligands and proteins. This tender does not contain any keywords or context related to flood protection, prevention, or flood-related infrastructure. The department involved is the Department of Higher Education, which is not typically associated with flood management projects. Overall, this tender appears to be for a non-flood-related bioinformatics research project.",Non-Flood,success,
2024_HFWD_35857_1,MCH/HMS/2023/320/15,"supply of Consumables in the HLA Laboratory, department of Anatomy and Hemopathology, HMS, GMCH, Guwahati","supply of Consumables in the HLA Laboratory, department of Anatomy and Hemopathology, HMS, GMCH, Guwahati",Goods,Open Tender,Item Wise,Lab Chemistry Reagents,No,No,NA ,01-Feb-2024 05:35 PM,05-Feb-2024 01:00 PM ,365.0,No ,No,Online,15-Feb-2024 04:00 PM,Health and Family Welfare Department||Directorate of Medical Education-HFWD||Guwahati Medical College Hospital-HFWD,"GMCH, Bhangagarh, Guwahati- 32",781032.0,2.0,,CPC Diagnostics Priavat Limited,"203,845",Accepted-AOC,18-Nov-2024,Health and Family Welfare Department||Directorate of Medical Education-HFWD||Guwahati Medical College Hospital-HFWD,"The tender is for the supply of consumables for the HLA (Human Leukocyte Antigen) Laboratory in the Department of Anatomy and Hemopathology at the Guwahati Medical College Hospital. This appears to be a routine procurement for a medical facility and does not mention any flood-related aspects. The tender does not contain any keywords or context indicating flood protection, prevention, or mitigation works. Additionally, there is no information provided about the temporal factors or geographic relevance to flood-prone areas. Based on the available details, this tender does not appear to be related to flood-related infrastructure or development projects.",Non-Flood,success,
2024_HFWD_37063_1,Essential Consumable Items 2024,Essential Consumable Items,Supply of essential consumable items.,Goods,Open Tender,Item Rate,Medicines,No,No,NA ,08-Mar-2024 06:50 PM,15-Mar-2024 02:30 PM ,180.0,No ,No,Online,06-Apr-2024 04:00 PM,Health and Family Welfare Department||Assam Medical Services Corporation Limited,AMSCL,781026.0,2.0,,JACKSON CARE PRODUCT,100.0,Rejected-Technical,20-Nov-2024,Health and Family Welfare Department||Assam Medical Services Corporation Limited,"The tender is for the ""Supply of essential consumable items"" for the Health and Family Welfare Department and Assam Medical Services Corporation Limited. There are no flood-related keywords or context mentioned in the tender details. The tender does not appear to be related to any flood protection, prevention, or mitigation works. It is a routine procurement of general consumable items, which is not a flood-related activity.",Non-Flood,success,
2024_HFWD_37537_1,MCH/HMS/2024/328/6,"Chartered Accountants Firm for Auditing and Tax related Jobs of GMCH, PMJAY scheme in GMCH and HMS, GMCH on yearly lump sum payment basis","Chartered Accountants Firm for Auditing and Tax related Jobs of GMCH, PMJAY scheme in GMCH and HMS, GMCH on yearly lump sum payment basis",Services,Open Tender,Item Rate,Consultancy,No,No,NA ,07-Jun-2024 03:00 PM,12-Jun-2024 12:00 PM ,365.0,No ,No,Online,28-Jun-2024 04:00 PM,Health and Family Welfare Department||Directorate of Medical Education-HFWD||Guwahati Medical College Hospital-HFWD,"GMCH, Bhangagarh, Guwahati",781032.0,2.0,,RAMA K GUPTA AND CO.,"150,000",Rejected-Technical,27-Nov-2024,Health and Family Welfare Department||Directorate of Medical Education-HFWD||Guwahati Medical College Hospital-HFWD,"The tender is for the appointment of a Chartered Accountants Firm to provide auditing and tax-related services for the Guwahati Medical College Hospital (GMCH), the PMJAY scheme in GMCH, and the Hospital Management System (HMS) of GMCH. This tender does not appear to be related to any flood-related infrastructure or development projects. The description and department information indicate that this is a routine administrative and financial management task, without any mention of flood protection, prevention, or mitigation. There are no flood-related keywords or context present in the tender details.",Non-Flood,success,
2024_HFWD_37788_2,SMEJ/JMCH/2419/20/PtII/24/2706 Date.27/06/24,"SUPPLY OF DRUGS, CONSUMABLES ETC. FOR SCNU, PICU, NRC, KMC, DEPTT. OF PAEDIATRICS AT JORHAT MEDICAL COLLEGE AND HOSPITAL, JORHAT","SUPPLY OF DRUGS, CONSUMABLES ETC. FOR SCNU, PICU, NRC, KMC, DEPTT. OF PAEDIATRICS AT JORHAT MEDICAL COLLEGE AND HOSPITAL, JORHAT",Goods,Open Tender,Supply,Medicines,No,No,NA ,09-Jul-2024 06:20 PM,NA ,365.0,No ,No,Online,29-Jul-2024 01:00 PM,Health and Family Welfare Department||Directorate of Medical Education-HFWD||Jorhat Medical College and Hospital-HFWD,"JORHAT MEDICAL COLLEGE AND HOSPITAL, JORHAT-ASSAM",785001.0,2.0,"40,00,000",ITAS G. PHARMA,0.0,Accepted-AOC,27-Sep-2024,Health and Family Welfare Department||Directorate of Medical Education-HFWD||Jorhat Medical College and Hospital-HFWD,"The tender is for the supply of drugs, consumables, etc. for various pediatric departments at the Jorhat Medical College and Hospital. It does not mention any flood-related works, infrastructure, or emergency response. The tender is not focused on flood protection, prevention, or restoration, and there are no keywords or context indicating a flood-related project. The department involved is the Health and Family Welfare Department, which is not typically associated with flood management. Based on the information provided, this tender appears to be for regular medical supplies and equipment, and not a flood-related project.",Non-Flood,success,
2024_HFWD_38130_1,BNCCH/2024-25/803,Supply of Medicines,Supply of Medicines,Goods,Open Tender,Supply,Medicines,No,Yes,NA ,22-Jul-2024 05:30 PM,,60.0,No ,No,Online,12-Aug-2024 04:00 PM,"Health and Family Welfare Department||Directorate of Health Services||Joint DHS, Biswanath||O/o the Superintendent Biswanath Civil Hospital",Biswanath Chariali Civil Hospital,784176.0,2.0,,Good Health Drugs and Surgical,"7,399",Accepted-AOC,06-Nov-2024,"Health and Family Welfare Department||Directorate of Health Services||Joint DHS, Biswanath||O/o the Superintendent Biswanath Civil Hospital","The tender is for the supply of medicines, which is a routine health department activity and not directly related to flood management or infrastructure. There are no flood-related keywords or context mentioned in the tender details. The department and project scope are also not indicative of any flood-related work. Therefore, this tender can be classified as non-flood related.",Non-Flood,success,
2024_HFWD_38172_1,No. MCH/HMS/2024/330/25,"Supply of Instruments, Reagents, etc. related to organ transplantation in the HLA Laboratory and Multidisciplinary Research Unit (MRU) of GMCH, Guwahati","Supply of Instruments, Reagents, etc. related to organ transplantation in the HLA Laboratory and Multidisciplinary Research Unit (MRU) of GMCH, Guwahati",Goods,Open Tender,Item Wise,Laboratory and scientific equipment,No,No,NA ,24-Jul-2024 12:00 PM,30-Jul-2024 12:00 PM ,365.0,No ,No,Online,14-Aug-2024 04:00 PM,Health and Family Welfare Department||Directorate of Medical Education-HFWD||Guwahati Medical College Hospital-HFWD,"GMCH, Bhangagarh, Guwahati",781032.0,2.0,,North East Enterprise,469.68,Accepted-AOC,28-Nov-2024,Health and Family Welfare Department||Directorate of Medical Education-HFWD||Guwahati Medical College Hospital-HFWD,"The tender is for the supply of instruments, reagents, and other equipment related to organ transplantation in the HLA Laboratory and Multidisciplinary Research Unit (MRU) of the Guwahati Medical College Hospital. This tender does not appear to be related to flood protection, prevention, or management. The description and department involved (Health and Family Welfare Department) indicate that this is a standard medical procurement tender, without any flood-related components or context.",Non-Flood,success,
2024_HFWD_38303_1,NHM/GMCH/11/PART-V/260/686,"supply of medicines, surgical items and consumables for the department of Oand G (CS and Normal Delivery) and Pediatrics (NICU and PICU) GMCH, Guwahati 32","supply of medicines, surgical items and consumables for the department of Oand G (CS and Normal Delivery) and Pediatrics (NICU and PICU) GMCH, Guwahati 32",Goods,Open Tender,Item Wise,Medicines,No,No,NA ,01-Aug-2024 05:00 PM,06-Aug-2024 11:30 AM ,365.0,No ,No,Online,27-Aug-2024 04:00 PM,Health and Family Welfare Department||Directorate of Medical Education-HFWD||Guwahati Medical College Hospital-HFWD,"GMCH, Bhangagarh, Guwahati",781032.0,2.0,,SRL Associates,"5,551.82",Accepted-AOC,28-Nov-2024,Health and Family Welfare Department||Directorate of Medical Education-HFWD||Guwahati Medical College Hospital-HFWD,"The tender is for the supply of medicines, surgical items, and consumables for the departments of Obstetrics and Gynecology (including Cesarean Section and Normal Delivery) and Pediatrics (including Neonatal Intensive Care Unit and Pediatric Intensive Care Unit) at the Guwahati Medical College Hospital. This tender does not appear to be related to flood-related infrastructure or development projects. There are no keywords or context indicating any flood protection, prevention, or mitigation works. The tender is for routine medical supplies and equipment, which are not directly associated with flood-related activities.",Non-Flood,success,
2024_HFWD_38518_1,SMEJ/JMCH/2571/21/PTII/24/3423 Dt.13/08/24,"SUPPLY OF OFFICE STATIONERY AND OTHER OFFICE CONSUMABLE ITEMS ON RATE CONTRACT BASIS FOR JORHAT MEDICAL COLLEGE AND HOSPITAL, JORHAT (ASSAM)","SUPPLY OF OFFICE STATIONERY AND OTHER OFFICE CONSUMABLE ITEMS ON RATE CONTRACT BASIS FOR JORHAT MEDICAL COLLEGE AND HOSPITAL, JORHAT (ASSAM)",Goods,Open Tender,Supply,Stationery,No,No,NA ,16-Aug-2024 04:20 PM,21-Aug-2024 01:00 PM ,365.0,No ,No,Online,05-Sep-2024 01:00 PM,Health and Family Welfare Department||Directorate of Medical Education-HFWD||Jorhat Medical College and Hospital-HFWD,"JORHAT MEDICAL COLLEGE AND HOSPITAL, JORHAT-ASSAM",785001.0,2.0,"25,00,000",Stationery House,0.0,Accepted-AOC,08-Nov-2024,Health and Family Welfare Department||Directorate of Medical Education-HFWD||Jorhat Medical College and Hospital-HFWD,"The tender is for the supply of office stationery and other office consumable items for the Jorhat Medical College and Hospital. It does not mention any flood-related works, infrastructure, or emergency response. The department involved is the Health and Family Welfare Department, which is not typically associated with flood management or mitigation. There are no keywords or context indicating this tender is related to flood protection, prevention, or restoration. Based on the information provided, this tender appears to be for routine administrative and procurement activities, rather than any flood-related project.",Non-Flood,success,
2024_HFWD_38878_1,FAAMCH/eT_ST/1997/2024-25/1392,Rate contract for supply of Stationery items,"Rate contract for supply of Stationery items at FAAMCH, Barpeta",Goods,Open Tender,Item Wise,Stationery,No,No,NA ,12-Sep-2024 10:00 AM,19-Sep-2024 02:30 PM ,180.0,No ,No,Online,04-Oct-2024 12:30 PM,Health and Family Welfare Department||Directorate of Medical Education-HFWD||FAA Medical College and Hospital-Barpeta-HFWD,"FAAMCH, Barpeta, Assam",781301.0,2.0,,SRL Associates,0.0,Accepted-AOC,11-Nov-2024,Health and Family Welfare Department||Directorate of Medical Education-HFWD||FAA Medical College and Hospital-Barpeta-HFWD,"The tender is for the supply of stationery items at a medical college and hospital, which does not appear to be directly related to flood protection, prevention, or mitigation. The tender does not mention any flood-related keywords, infrastructure, or emergency response facilities. The department involved is the Health and Family Welfare Department, which is not typically associated with flood management projects. Overall, there is no clear indication that this tender is for a flood-related project.",Non-Flood,success,
2024_HFWD_38986_1,No.MCH/2024/24012 dtd. 12/09/2024,For Selection of Pharmacies Supplier,For Selection of Pharmacies Supplier for supply of Medicines Surgical Consumables and Implants to Public Health Facilities under Atal Amrit Abhiyan and Ayushman Bharat Pradhan Mantri Jan Arogya Yojana,Goods,Open Tender,Supply,Medicines,No,No,NA ,13-Sep-2024 04:30 PM,16-Sep-2024 11:30 AM ,365.0,No ,No,Online,07-Oct-2024 12:30 PM,Health and Family Welfare Department||Directorate of Medical Education-HFWD||Assam Medical College Hospital-Dibrugarh-HFWD,Assam Medical College Hospital Dibrugarh,786002.0,2.0,"1,00,00,000",VAISHNAVY MEDICOS,137.0,Accepted-AOC,05-Nov-2024,Health and Family Welfare Department||Directorate of Medical Education-HFWD||Assam Medical College Hospital-Dibrugarh-HFWD,"The tender is for the selection of pharmacies to supply medicines, surgical consumables, and implants to public health facilities. It does not mention any flood-related works, infrastructure, or emergency response. The department involved is the Health and Family Welfare Department, which is not typically associated with flood management. There are no keywords or context indicating this is a flood-related project. The tender appears to be for routine procurement of medical supplies, which is a non-flood-related activity.",Non-Flood,success,
2024_HFWD_39900_1,MCH/HMS/2023/316/123,"Supply of Equipments in the deptt. of Microbiology under HMS, Gauhati Medical College Hospital, Guwahati, Assam","Supply of Equipments in the deptt. of Microbiology under HMS, Gauhati Medical College Hospital, Guwahati, Assam",Goods,Open Tender,Item Wise,Laboratory and scientific equipment,No,No,NA ,14-Oct-2024 05:30 PM,19-Oct-2024 01:30 PM ,365.0,No ,No,Online,04-Nov-2024 04:00 PM,Health and Family Welfare Department||Directorate of Medical Education-HFWD||Guwahati Medical College Hospital-HFWD,"GMCH, Bhangagarh, Guwahati",781032.0,2.0,,U D Scientific,"239,540",Rejected-Technical,28-Nov-2024,Health and Family Welfare Department||Directorate of Medical Education-HFWD||Guwahati Medical College Hospital-HFWD,"The tender is for the supply of equipment for the Department of Microbiology at the Gauhati Medical College Hospital. It does not mention any flood-related works, infrastructure, or emergency response. The department and project scope are not related to flood protection, prevention, or management. There are no keywords or context indicating this is a flood-related tender.",Non-Flood,success,
