2024_AEGEF_35354_1,AEGCL/AIIB/PKG-H(R)/23/01H(R),"Construction of 400KV GIS at Sonapur(New) with associated Transmission Lines, (Package H)","Construction of 400KV GIS at Sonapur(New) with associated Transmission Lines, (Package H)",Works,Open Tender,Turn-key,Power/Energy Projects/Products,Yes,No,NA ,10-Jan-2024 02:00 PM,29-Jan-2024 02:00 PM ,180.0,No ,No,Online,29-Mar-2024 03:00 PM,Assam Electricity Grid Corporation Ltd. - Externally Funded Projects||Project Planning and Development- PPnD,SONAPUR,782402.0,2.0,,Techno Electric and Engineering co Ltd,"6,159,903,245",Rejected-Technical,19-Nov-2024,Assam Electricity Grid Corporation Ltd. - Externally Funded Projects||Project Planning and Development- PPnD,"The tender is for the construction of a 400KV GIS (Gas Insulated Substation) at Sonapur(New) with associated Transmission Lines. While the project involves infrastructure development, there is no explicit mention of flood-related work or flood mitigation measures. The tender description and department information do not indicate any specific focus on flood protection or management. The project appears to be a regular power infrastructure development initiative rather than a flood-related one.",Non-Flood,success,
2024_APDCL_37867_1,CAR/BorderLighting/2024,Laying of underground cable,Laying of 4 nos. of 11 KV 1-Core 185 sqmm underground cable at Elephant Corridor to facilitate safe movement of elephants between Adamtilla and Champabari for border flood lighting work under deposit scheme under Badarpur Electrical Circle,Works,Open Tender,Turn-key,Electrical Works,No,No,NA ,06-Jul-2024 10:00 AM,09-Jul-2024 11:00 AM ,180.0,No ,No,Online,16-Jul-2024 05:00 PM,Assam Power Distribution Company Ltd||CGM(D) Central Assam Region - APDCL,Badarpur,788806.0,2.0,,Valley Power Systems,"8,205,004.92",Rejected-Finance,04-Nov-2024,Assam Power Distribution Company Ltd||CGM(D) Central Assam Region - APDCL,"The tender is for laying underground cables to facilitate safe movement of elephants between Adamtilla and Champabari for border flood lighting work. This suggests the primary purpose is not direct flood protection or prevention, but rather infrastructure development to support wildlife movement in a flood-prone area. While the tender mentions the work is under a ""deposit scheme"" and is related to ""border flood lighting"", the overall context indicates this is more of a general infrastructure project rather than a dedicated flood management initiative. There are no clear primary indicators of flood-related works, and the secondary indicators like infrastructure reinforcement in a flood zone are not the main focus. The temporal factors are also unclear, as the tender does not specify if this is a pre-monsoon, post-flood, or routine project. Therefore, the flood relation, while present, is not the primary purpose of the tender.",Ambiguous,success,
2024_APDCL_39826_1,APDCL/CGM(COM_EE)/HYDRO/2024/6,Providing Consultancy/Regulatory Support Services to APDCL,Providing Consultancy/Regulatory Support Services to APDCL with regard to a single tender for procurement of HYDRO Power on Long-term basis through tariff based competitive bidding process,Services,Open Tender,Works,Consultancy,No,No,NA ,08-Oct-2024 06:30 PM,15-Oct-2024 12:00 PM ,90.0,No ,No,Online,30-Oct-2024 03:00 PM,Assam Power Distribution Company Ltd||CGM(Commercial) - APDCL||GM Commercial Revenue - APDCL,Assam,781001.0,2.0,,MERCADOS ENERGY MARKETS INDIA PRIVATE LIMITED,"2,802,500",Rejected-Technical,19-Nov-2024,Assam Power Distribution Company Ltd||CGM(Commercial) - APDCL||GM Commercial Revenue - APDCL,"The tender is for providing consultancy and regulatory support services to the Assam Power Distribution Company Ltd (APDCL) regarding a single tender for procurement of hydropower on a long-term basis through a tariff-based competitive bidding process. There are no explicit mentions of any flood-related works, infrastructure, or emergency response. The tender does not appear to be directly related to flood protection, prevention, or restoration. It seems to be a general consultancy and regulatory support service for a power procurement process, which is not a primary indicator of a flood-related project.",Non-Flood,success,
2024_APGCL_39183_1,APGCL/CGM (HC)/2024-25/3rd Floor Renovation Phase 2/05(24),Renovation Of Office Space,"Renovation Of Office Space at Third Floor, Bijulee Bhawan, Paltanbazar, Guwahati-01, Phase-2 (In Line With Phase-1).",Works,Open Tender,Works,Civil Works - Others,No,No,NA ,25-Sep-2024 10:00 AM,NA ,180.0,No ,No,Online,09-Oct-2024 02:00 PM,Assam Power Generation Company Limited,"APGCL, 3rd Floor, Bijulee Bhawan, Guwahati-781001",781001.0,2.0,"98,05,079",WILQO INDIA ENGINEERING,"9,804,999",Rejected-Technical,28-Nov-2024,Assam Power Generation Company Limited,"The tender is for the renovation of office space at the Bijulee Bhawan in Guwahati, which is a regular construction and maintenance activity. There are no mentions of any flood-related works, infrastructure, or emergency response. The tender does not contain any keywords or context indicating flood protection, prevention, or mitigation. Additionally, the department involved is the Assam Power Generation Company Limited, which is not typically associated with flood management projects. Therefore, this tender is likely for a non-flood-related activity.",Non-Flood,success,
2024_BoTC_35360_1,DPRD/BTC/(SOPD)Udl-22/2023/08,Construction of EF and SG road with 1 No Box culvert in Edenbari village from Peters house to Pucca road Fegas tea Garden under SOPD for the year 2023-24.,DPRD/BTC/(SOPD)Udl-22/2023/08,Works,Open Tender,Item Rate,Civil Works – Roads,No,No,NA ,10-Jan-2024 10:30 AM,NA ,180.0,No ,No,Online,01-Feb-2024 02:30 PM,Bodoland Territorial Council||Panchayat and Rural Development-BTC,Udalguri,784509.0,2.0,"37,26,726",ALMA BASUMATARY,"3,726,631.49",Accepted-AOC,08-Feb-2024,Bodoland Territorial Council||Panchayat and Rural Development-BTC,"The tender is for the construction of a road and a box culvert in Edenbari village, which suggests that it is related to flood management and infrastructure. The project is being undertaken under the SOPD (Special Opportunity for Panchayat Development) scheme, which is a government program focused on rural development. The mention of the box culvert indicates that the project is aimed at improving drainage and flood control in the area. Additionally, the tender is for the year 2023-24, which is the pre-monsoon period, further suggesting that the project is intended to prepare for the upcoming flood season.",Flood,success,
2024_BoTC_35667_1,DPRD/BTC/(15th FC)UT-135/2023/10,Const of road with sand gravelling from Bhowraguri Kachugaon PWD road to Sonapur village road under 15th FC for the year 2023-24.,DPRD/BTC/(15th FC)UT-135/2023/10,Works,Open Tender,Item Rate,Civil Works – Roads,No,No,NA ,24-Jan-2024 10:30 AM,NA ,180.0,No ,No,Online,15-Feb-2024 02:30 PM,Bodoland Territorial Council||Panchayat and Rural Development-BTC,Kachugaon,783350.0,2.0,"23,76,238",Binay Mushahary,"2,375,995.42",Rejected-Finance,08-Mar-2024,Bodoland Territorial Council||Panchayat and Rural Development-BTC,"The tender is for the construction of a road with sand gravelling from Bhowraguri Kachugaon PWD road to Sonapur village road under the 15th Finance Commission for the year 2023-24. While the tender mentions the department as Bodoland Territorial Council and Panchayat and Rural Development-BTC, it does not explicitly state any flood-related purpose or context. The tender appears to be for a regular road construction project, without any specific references to flood protection, prevention, or mitigation measures. There are no keywords or descriptions indicating the project is related to flood-related infrastructure, emergency response, or drainage systems in flood-prone areas. Therefore, based on the information provided, this tender is more likely to be a non-flood-related project.",Non-Flood,success,
2024_BoTC_35699_1,DOE/BTC/Samagra Shiksha/02/2023-24,"Construction of 3 Nos. of ACR at Garuajhar High School, Udalguri under BTC, funded by Samagra Siksha, Assam for the year 2023-24","Construction of 3 Nos. of ACR at Garuajhar High School, Udalguri under BTC, funded by Samagra Siksha, Assam for the year 2023-24",Works,Open Tender,Works,Civil Works - Building,No,No,NA ,25-Jan-2024 10:00 AM,NA ,180.0,No ,No,Online,16-Feb-2024 03:00 PM,Bodoland Territorial Council||Education-BTC,Udalguri,784509.0,2.0,"53,09,910",PANKAJ DEBNATH,"5,309,483.11",Rejected-Technical,29-Nov-2024,Bodoland Territorial Council||Education-BTC,"The tender is for the construction of 3 Auxiliary Classroom Rooms (ACR) at Garuajhar High School in Udalguri, Assam. The project is funded by Samagra Siksha, Assam and is not directly related to flood protection or mitigation. The tender does not mention any flood-related keywords, infrastructure, or emergency response facilities. It appears to be a regular construction project for educational infrastructure, without any specific flood-related context or purpose. Therefore, this tender is classified as non-flood related.",Non-Flood,success,
2024_BoTC_37997_1,DPRD/BTC/(Gen)-248/2024/32,"Procurement of various Office materials at Director Office PNRD, BDOs and VCDC Offices under BTR under 15th FC for the year 2023-24 under Untied Grants (1st Installment),",DPRD/BTC/(Gen)-248/2024/32,Goods,Open Tender,Item Rate,Miscellaneous Goods,No,No,NA ,15-Jul-2024 10:30 AM,NA ,180.0,No ,No,Online,06-Aug-2024 03:00 PM,Bodoland Territorial Council||Panchayat and Rural Development-BTC,At Director Office PNRD BDOs and VCDC Offices und,783370.0,2.0,"4,99,98,920",BIDINTHA BASUMATARY,"49,998,920",Accepted-AOC,28-Oct-2024,Bodoland Territorial Council||Panchayat and Rural Development-BTC,"The tender is for the procurement of various office materials for the Director Office of the Panchayat and Rural Development Department (PNRD), Block Development Offices (BDOs), and Village Council Development Committee (VCDC) Offices under the Bodoland Territorial Region (BTR) under the 15th Finance Commission's Untied Grants. The tender does not mention any flood-related works, infrastructure, or emergency response. It appears to be a routine procurement of office supplies and materials, which is not directly related to flood protection, prevention, or mitigation. The department involved is the Panchayat and Rural Development Department, which is not typically associated with flood management. There are no flood-related keywords or context provided in the tender details.",Non-Flood,success,
2024_BoTC_38444_1,DPRD/BTC/(15th FC)UT/VI/Udl-13/2024/05,Const of road with E/F and S/G from Khasibari village to Sastrapara village under 15th FC Untied Grant for the year 2023-24 during 2024-25.,DPRD/BTC/(15th FC)UT/VI/Udl-13/2024/05,Works,Open Tender,Item Rate,Civil Works,No,No,NA ,12-Aug-2024 10:30 AM,NA ,180.0,No ,No,Online,03-Sep-2024 02:30 PM,Bodoland Territorial Council||Panchayat and Rural Development-BTC,Udalguri,784509.0,2.0,"24,78,120",Hemen Basumatary,"2,477,116.12",Accepted-AOC,23-Sep-2024,Bodoland Territorial Council||Panchayat and Rural Development-BTC,"The tender is for the construction of a road with embankment and surface grading from Khasibari village to Sastrapara village under the 15th Finance Commission Untied Grant. While the tender mentions ""E/F and S/G"" which could potentially refer to flood-related works, the overall description and context do not clearly indicate that this is a flood-related project. The tender is for general road construction and improvement, which is a common infrastructure development activity not necessarily specific to flood management or prevention. The department involved is the Bodoland Territorial Council's Panchayat and Rural Development, which suggests a broader rural development focus rather than a specialized flood-related agency. Therefore, based on the information provided, this tender is more likely to be a non-flood-related infrastructure project.",Non-Flood,success,
2024_BoTC_38445_1,DPRD/BTC/(15th FC)UT/VI/Udl-03/2024/07,Const of road with heavy earth filling and s and gravelling from Factory Gate to Corramore Tinali under 15th FC Untied Grant for the year 2023-24 during 2024-25.,DPRD/BTC/(15th FC)UT/VI/Udl-03/2024/07,Works,Open Tender,Item Rate,Civil Works,No,No,NA ,12-Aug-2024 10:30 AM,NA ,180.0,No ,No,Online,03-Sep-2024 02:30 PM,Bodoland Territorial Council||Panchayat and Rural Development-BTC,Udalguri,784509.0,2.0,"23,78,947",SANJIB DAIMARY,"2,378,311.33",Rejected-AOC,29-Sep-2024,Bodoland Territorial Council||Panchayat and Rural Development-BTC,"The tender is for the construction of a road with heavy earth filling and sand gravelling from Factory Gate to Corramore Tinali under the 15th Finance Commission Untied Grant for the year 2023-24 during 2024-25. While the tender mentions the work being carried out in a flood-prone area, it does not explicitly state that the purpose is for flood protection or mitigation. The tender details do not indicate any primary flood-related components such as embankment construction, drainage systems, or erosion control measures. The work appears to be a regular road construction project, which may have some secondary benefits in terms of improved accessibility during floods, but the primary purpose is not flood-related. Therefore, based on the information provided, this tender is more likely to be a non-flood-related infrastructure project.",Non-Flood,success,
2024_BoTC_38451_1,DPRD/BTC/(15th FC)UT/V/Udl-14/2024/10,Const of road with E/F and S/G alongwith 4 RCC Culvert from Gadabil to Dera Centre (Approx 3.5 Km) under 15th FC Untied Grant (2nd Installment) for the year 2022-23 during 2024-25.,DPRD/BTC/(15th FC)UT/V/Udl-14/2024/10,Works,Open Tender,Item Rate,Civil Works,No,No,NA ,12-Aug-2024 10:30 AM,NA ,180.0,No ,No,Online,03-Sep-2024 02:30 PM,Bodoland Territorial Council||Panchayat and Rural Development-BTC,Mazbat Udalguri,784507.0,2.0,"65,35,353",HEMAN HAINARI,"6,535,352.95",Accepted-AOC,21-Sep-2024,Bodoland Territorial Council||Panchayat and Rural Development-BTC,"The tender is for the construction of a road with embankment, side gutters, and 4 RCC culverts from Gadabil to Dera Centre, covering a distance of approximately 3.5 km. The project is being undertaken under the 15th Finance Commission's Untied Grant for the year 2022-23, to be executed during 2024-25. The tender description indicates that this is a flood-related infrastructure project, as it involves the construction of embankments, culverts, and drainage systems, which are typically associated with flood mitigation and management. The project's location in a rural area and the involvement of the Panchayat and Rural Development department further suggest that it is addressing flood-prone areas. Additionally, the timing of the project, which is scheduled for the pre-monsoon period, indicates that it is likely a preparatory measure for the upcoming flood season.",Flood,success,
2024_BoTC_38599_1,FSHRY/BTC/2024-25/008/1,Supply of Bicycle with Ice Box for Gents and Ladies in BTR,Supply of Bicycle with Ice Box for Gents and Ladies in BTR,Goods,Open Tender,Supply,Supply of Materials,No,No,NA ,22-Aug-2024 12:15 PM,NA ,180.0,No ,No,Online,11-Sep-2024 12:00 PM,Bodoland Territorial Council||Fisheries-BTC,in BTR,783370.0,2.0,"2,00,00,000",Sri Jatish Ray,"19,993,952",Rejected-Finance,15-Nov-2024,Bodoland Territorial Council||Fisheries-BTC,"The tender is for the supply of bicycles with ice boxes for the Bodoland Territorial Council (BTC) Fisheries department. This does not appear to be directly related to flood protection, prevention, or management. The tender does not mention any flood-related keywords, infrastructure, or emergency response. It seems to be a regular procurement of bicycles and ice boxes, likely for general transportation and storage purposes, rather than a flood-specific project. The department involved, Fisheries-BTC, also does not indicate a flood management focus. Overall, there is no clear flood-related context or purpose in this tender.",Non-Flood,success,
2024_BoTC_38601_1,FSHRY/BTC/2024-25/008/1,Supply of Inputs for Duck cum Fish culture in BTR,Supply of Inputs for Duck cum Fish culture in BTR,Goods,Open Tender,Supply,Miscellaneous Goods,No,No,NA ,22-Aug-2024 01:10 PM,NA ,180.0,No ,No,Online,11-Sep-2024 12:00 PM,Bodoland Territorial Council||Fisheries-BTC,in BTR,783370.0,2.0,"1,00,00,000",Sri Jatish Ray,"9,994,000",Rejected-Finance,15-Nov-2024,Bodoland Territorial Council||Fisheries-BTC,"The tender is for the ""Supply of Inputs for Duck cum Fish culture in BTR"", which does not appear to be directly related to flood protection, prevention, or management. The description and department (Fisheries-BTC) indicate that this is a regular development project for aquaculture, rather than a flood-specific initiative. There are no keywords or context suggesting this is a flood-related work.",Non-Flood,success,
2024_BoTC_38604_1,FSHRY/BTC/2024-25/008/1,Supply of inputs for Pig cum Fish culture in BTR,Supply of inputs for Pig cum Fish culture in BTR,Goods,Open Tender,Supply,Supply of Materials,No,No,NA ,22-Aug-2024 01:50 PM,NA ,180.0,No ,No,Online,11-Sep-2024 12:00 PM,Bodoland Territorial Council||Fisheries-BTC,in BTR,783370.0,2.0,"1,00,00,000",Sri Jatish Ray,"9,993,840",Rejected-Finance,15-Nov-2024,Bodoland Territorial Council||Fisheries-BTC,"The tender is for the ""Supply of inputs for Pig cum Fish culture in BTR"", which does not appear to be directly related to flood protection, prevention, or management. The description and department information indicate this is a general fisheries and livestock development project, rather than a flood-specific infrastructure or restoration work. There are no clear flood-related keywords, temporal factors, or geographic context provided that would suggest this is a flood-related tender. Therefore, based on the information given, this tender is likely for non-flood-related activities.",Non-Flood,success,
2024_BoTC_38747_1,DPRD/BTC/15FC/UT-V/Bak-2/24/20,Construction of road with EF and SG from Udugaon to Khusrabari Barpeta Pucca road along with 2 Nos of slab culvert under 15th FC (Untied Grant) for the year 2022-23 during 2024-25.,DPRD/BTC/15FC/UT-V/Bak-2/2024/20,Works,Open Tender,Item Rate,Civil Works,No,No,NA ,02-Sep-2024 10:30 AM,NA ,180.0,No ,No,Online,24-Sep-2024 02:30 PM,Bodoland Territorial Council||Panchayat and Rural Development-BTC,Gobardhana,781315.0,2.0,"39,64,912",Pradip Narzary,"3,964,580.2",Not Admitted-Fee/PreQual/Technical,05-Oct-2024,Bodoland Territorial Council||Panchayat and Rural Development-BTC,"The tender is for the construction of a road with embankment and slab culverts from Udugaon to Khusrabari Barpeta, which suggests that the project is focused on improving infrastructure in a flood-prone area. The mention of the 15th Finance Commission (Untied Grant) for the year 2022-23 during 2024-25 indicates that this is a planned, pre-monsoon preparation work. The project scope includes flood-related infrastructure like embankments and culverts, which are primary indicators of a flood-related project. Additionally, the geographic location in Barpeta, which is prone to flooding, further supports the classification of this tender as flood-related.",Flood,success,
2024_BoTC_38902_1,DPRD/BTC/(15th FC)UT/VI/Udl-21/2024/08,Const of RCC Slab Culvert Gergemokha village (Bhairaguri VCDC) under 15th FC Untied Grant for the year 2023-24 during 2024-25.,DPRD/BTC/(15th FC)UT/VI/Udl-21/2024/08,Works,Open Tender,Item Rate,Civil Works,No,No,NA ,09-Sep-2024 10:30 AM,NA ,180.0,No ,No,Online,01-Oct-2024 02:30 PM,Bodoland Territorial Council||Panchayat and Rural Development-BTC,Udalguri,784509.0,2.0,"19,80,198",Rahul Basumatary,"1,980,198.43",Rejected-AOC,31-Oct-2024,Bodoland Territorial Council||Panchayat and Rural Development-BTC,"The tender is for the construction of an RCC slab culvert in Gergemokha village under the Bodoland Territorial Council (BTC). The project is funded by the 15th Finance Commission's Untied Grant for the year 2023-24, to be executed during 2024-25. The tender description indicates that this is a flood-related infrastructure project, as culverts are typically used to manage water flow and prevent flooding in flood-prone areas. The geographic location of the project, Gergemokha village, also suggests that it is in a flood-prone region. Additionally, the timing of the project, which is scheduled for the pre-monsoon period, further supports the flood-related nature of the work.",Flood,success,
2024_BoTC_39007_1,DPRD/BTC/(15th FC)UT/VI/Udl-10/2024/07,Const of RCC Slab Culvert at Kundrabil (Amjuli VCDC) under 15th FC Untied Grant for the year 2023-24 during 2024-25.,DPRD/BTC/(15th FC)UT/VI/Udl-10/2024/07,Works,Open Tender,Item Rate,Civil Works,No,No,NA ,14-Sep-2024 10:30 AM,NA ,180.0,No ,No,Online,07-Oct-2024 02:30 PM,Bodoland Territorial Council||Panchayat and Rural Development-BTC,Udalguri,784509.0,2.0,"23,76,512",Rahul Basumatary,"2,376,511.82",Rejected-AOC,12-Nov-2024,Bodoland Territorial Council||Panchayat and Rural Development-BTC,"The tender is for the construction of an RCC slab culvert at Kundrabil (Amjuli VCDC) under the 15th Finance Commission Untied Grant for the year 2023-24. The project is being undertaken by the Bodoland Territorial Council's Panchayat and Rural Development department. While the tender does not explicitly mention flood-related keywords, the construction of a culvert in a rural area suggests that it may be intended to improve drainage and mitigate the impact of floods in the region. The project's timing during the 2024-25 fiscal year also indicates that it may be part of pre-monsoon preparation works. Therefore, the project can be considered as having a secondary flood-related purpose, even though it is not the primary focus.",Flood,success,
2024_BoTC_39011_1,TECH17/SEB/ETender/2021_22/37,"Construction of Dhamdhama ICDS Project, Assam type Office such as CDPO Room, Supervisors Room, Stall Room, Meeting Hall, Godown, Electrification, Water Supply, Sanitation etc. under Women and Child Development Department.TN_617","Construction of Dhamdhama ICDS Project, Assam type Office such as CDPO Room, Supervisors Room, Stall Room, Meeting Hall, Godown, Electrification, Water Supply, Sanitation etc. under Women and Child Development Department.TN_617",Works,Open Tender,Works,Civil Works - Building,No,No,NA ,14-Sep-2024 02:00 PM,NA ,180.0,No ,No,Online,30-Sep-2024 02:00 PM,Bodoland Territorial Council||PWD-BTC,BAKSA,781372.0,2.0,"74,79,439",KUNJU RANI BARO,"7,478,000",Not Admitted-Fee/PreQual/Technical,02-Nov-2024,Bodoland Territorial Council||PWD-BTC,"The tender is for the construction of an ICDS (Integrated Child Development Services) project office in Dhamdhama, Assam. The project includes the construction of various rooms and facilities such as CDPO (Child Development Project Officer) room, supervisors' room, stall room, meeting hall, godown, electrification, water supply, and sanitation. While the tender mentions water supply and sanitation, these are standard components of a government office building and do not indicate a specific focus on flood-related infrastructure or flood management. The tender does not mention any flood protection, prevention, or mitigation measures, nor does it indicate that the project is located in a flood-prone area. The department involved is the Women and Child Development Department, which is not typically associated with flood-related projects. Overall, the tender appears to be for a regular government office building construction project and does not have a clear flood-related focus.",Non-Flood,success,
2024_BoTC_39019_1,DPRD/BTC/(15th FC)UT/VI/Udl-17/2024/08,Improvement of Road with CC Block from Hazoary house to PWD Mission link road under 15th FC Untied Grant for the year 2023-24 during 2024-25.,DPRD/BTC/(15th FC)UT/VI/Udl-17/2024/08,Works,Open Tender,Item Rate,Civil Works,No,No,NA ,16-Sep-2024 10:30 AM,NA ,180.0,No ,No,Online,08-Oct-2024 02:30 PM,Bodoland Territorial Council||Panchayat and Rural Development-BTC,Rowta Udalguri,784508.0,2.0,"29,70,588",Sri Birgrang Basumatary,"2,970,587.76",Rejected-AOC,04-Nov-2024,Bodoland Territorial Council||Panchayat and Rural Development-BTC,"The tender is for the improvement of a road with CC block from Hazoary house to PWD Mission link road under the 15th FC Untied Grant for the year 2023-24 during 2024-25. While the tender mentions the location being in a flood-prone area, the primary purpose appears to be general road infrastructure improvement rather than specific flood protection or mitigation measures. There are no explicit references to flood-related keywords like embankments, dykes, drainage systems, or erosion control. The tender also does not mention any temporal factors like pre-monsoon preparation or post-flood restoration. Overall, the tender seems to be for a routine road construction project, without a clear flood-related focus.",Non-Flood,success,
