2024_HFWD_38395_1,"Donor refreshment to the State of the Art Model Blood Bank, GMCH, Guwahati","Donor refreshment to the State of the Art Model Blood Bank, GMCH, Guwahati","Donor refreshment to the State of the Art Model Blood Bank, GMCH, Guwahati",Goods,Open Tender,Item Rate,Food Products,No,No,NA ,08-Aug-2024 05:00 PM,13-Aug-2024 12:00 PM ,365.0,No ,No,Online,22-Aug-2024 04:00 PM,Health and Family Welfare Department||Directorate of Medical Education-HFWD||Guwahati Medical College Hospital-HFWD,"GMCH, Bhangagarh, Guwahati",781032.0,2.0,,DEEP MONI MAZUMDER,23.01,Accepted-AOC,05-Oct-2024,Health and Family Welfare Department||Directorate of Medical Education-HFWD||Guwahati Medical College Hospital-HFWD,"The tender is for providing donor refreshment to the State of the Art Model Blood Bank at the Guwahati Medical College Hospital, which is under the Health and Family Welfare Department. There are no explicit mentions of any flood-related works, infrastructure, or emergency response. The tender does not appear to be related to flood protection, prevention, or mitigation. It seems to be a routine maintenance or support activity for the blood bank facility, which is not a flood-related project.",Non-Flood,success,
2024_HFWD_38896_1,MCH/HMS/2024/334/30,Supply of Laser for Retina Surgery with Accessories,Supply of Laser for Retina Surgery with Accessories,Goods,Open Tender,Item Rate,Machineries,No,No,NA ,07-Sep-2024 06:00 PM,13-Sep-2024 01:30 PM ,365.0,No ,No,Online,27-Sep-2024 04:00 PM,Health and Family Welfare Department||Directorate of Medical Education-HFWD||Guwahati Medical College Hospital-HFWD,"GMCH, Bhangagarh, Guwahati",781032.0,2.0,,Biosis Medical Services,"9,899,998",Accepted-AOC,24-Oct-2024,Health and Family Welfare Department||Directorate of Medical Education-HFWD||Guwahati Medical College Hospital-HFWD,"The tender is for the supply of a laser for retina surgery with accessories, which is a medical equipment procurement for a hospital. There are no mentions of any flood-related works, infrastructure, or emergency response. The department involved is the Health and Family Welfare Department, which is not typically associated with flood management or disaster response. Based on the information provided, this tender does not appear to be related to flood protection, prevention, or mitigation activities.",Non-Flood,success,
2024_HFWD_39089_1,MCH/HMS/2023/300/Pt-I/43,"supply of Pure Tone Audiometer in the deptt. of ENT, GMCH, Guwahati-32","supply of Pure Tone Audiometer in the deptt. of ENT, GMCH, Guwahati-32",Goods,Open Tender,Item Rate,Laboratory and scientific equipment,No,No,NA ,19-Sep-2024 05:00 PM,24-Sep-2024 01:00 PM ,365.0,No ,No,Online,03-Oct-2024 04:00 PM,Health and Family Welfare Department||Directorate of Medical Education-HFWD||Guwahati Medical College Hospital-HFWD,"GMCH, Bhangagarh, Guwahati",781032.0,2.0,,United Traders,"1,680,000",Rejected-Technical,24-Oct-2024,Health and Family Welfare Department||Directorate of Medical Education-HFWD||Guwahati Medical College Hospital-HFWD,"The tender is for the supply of a Pure Tone Audiometer for the Department of ENT at the Guwahati Medical College Hospital. This is a standard medical equipment procurement and does not appear to be related to any flood-related infrastructure or disaster management. The tender does not mention any flood protection, prevention, or mitigation works, nor does it involve any flood-prone infrastructure or emergency response facilities. The department and the nature of the procurement indicate this is a routine medical equipment purchase, not a flood-related project.",Non-Flood,success,
2024_ICD_37493_1,DNPL/PC/2023/DEHY/31/Pt-1/27,HIRING OF CONSULTANT FOR CONDENSATE REMOVAL SYSTEM (GAS DEHYDRATION SYSTEM) AND THEIR ASSOCIATED FACILITIES FOR DNPL PIPELINE,HIRING OF CONSULTANT FOR CONDENSATE REMOVAL SYSTEM (GAS DEHYDRATION SYSTEM) AND THEIR ASSOCIATED FACILITIES FOR DNPL PIPELINE,Services,Open Tender,Works,Consultancy,No,No,NA ,09-May-2024 12:30 PM,30-May-2024 02:00 PM ,180.0,No ,No,Online,03-Jul-2024 02:00 PM,Industries and Commerce Department||DNP Limited,Duliajan,786602.0,1.0,,PIPELINE ENGINEERING CONSULTANTS PRIVATE LIMITED,"13,550,000",Rejected-Technical,08-Oct-2024,Industries and Commerce Department||DNP Limited,"The tender is for the hiring of a consultant for a condensate removal system (gas dehydration system) and their associated facilities for a pipeline project. There are no explicit mentions of flood-related works, infrastructure, or emergency response. The tender does not appear to be focused on flood protection, prevention, or mitigation. The department involved is the Industries and Commerce Department, which is not typically associated with flood management. Overall, the tender details do not indicate a flood-related project.",Non-Flood,success,
2024_ICD_37835_1,DNPL/PC/2024/55KM/MHV/37/03,Procurement of Manual Hydraulic Ball Valves,Procurement of Manual Hydraulic Ball Valves,Goods,Open Tender,Supply,Supply of Materials,No,No,NA ,02-Jul-2024 03:35 PM,09-Jul-2024 11:00 AM ,180.0,No ,No,Online,24-Aug-2024 10:00 AM,Industries and Commerce Department||DNP Limited,Duliajan,786602.0,2.0,,MICROFINISH VALVES PVT LTD,"41,778,905.82",Rejected-Technical,09-Oct-2024,Industries and Commerce Department||DNP Limited,"The tender is for the procurement of manual hydraulic ball valves, which is a standard industrial equipment and not directly related to flood protection or mitigation. The tender does not mention any flood-related keywords, infrastructure, or emergency response. The department involved is the Industries and Commerce Department, which is not typically associated with flood management projects. Overall, there is no clear indication that this tender is for a flood-related project.",Non-Flood,success,
2024_ICD_37847_1,CIC/APART/CFC-HOJAI/Re-Bid/G-1,"Supply, Installation, Commissioning and Trial Run of 5TPH Milling Unit at Narayanpur, Hojai, Assam","Supply, Installation, Commissioning and Trial Run of 5TPH Milling Unit",Goods,Open Tender,Supply,Machineries,No,No,NA ,03-Jul-2024 10:00 AM,18-Jul-2024 03:00 PM ,90.0,No ,No,Online,22-Aug-2024 03:00 PM,Industries and Commerce Department||Commissioner Industries and Commerce Assam,M/s Dimoru Valley Agro Private Ltd. Hojai,782446.0,2.0,,SONA MACHINERY LIMITED,"16,899,960",Rejected-AOC,15-Oct-2024,Industries and Commerce Department||Commissioner Industries and Commerce Assam,,,failed,"Failed after 1 attempts: Error code: 429 - {'type': 'error', 'error': {'type': 'rate_limit_error', 'message': 'This request would exceed your organization’s rate limit of 50 requests per minute. For details, refer to: https://docs.anthropic.com/en/api/rate-limits; see the response headers for current usage. Please reduce the prompt length or the maximum tokens requested, or try again later. You may also contact sales at https://www.anthropic.com/contact-sales to discuss your options for a rate limit increase.'}}"
2024_ICD_38121_1,DNPL/COMP/AUG/2024/170/08,EOI,Engagement of an experienced consultancy farm for carrying out comprehensive Techno Economic Viability Study for future augmentation of gas compression capacity of DNPL,Services,Open Tender,EOI,Consultancy,No,No,NA ,22-Jul-2024 11:00 AM,NA ,180.0,No ,No,Not Applicable,27-Aug-2024 02:00 PM,Industries and Commerce Department||DNP Limited,Duliajan,786602.0,1.0,,PIPELINE ENGINEERING CONSULTANTS PRIVATE LIMITED,0.0,Accepted-AOC,14-Oct-2024,Industries and Commerce Department||DNP Limited,"The tender is for the engagement of a consultancy firm to carry out a techno-economic viability study for the future augmentation of gas compression capacity of DNPL (Dhamra Port Limited). This appears to be a regular infrastructure development project and does not have any direct relation to flood protection, prevention, or mitigation. The tender does not mention any flood-related keywords, emergency response, or seasonal timing. The department involved is the Industries and Commerce Department, which is not typically associated with flood management. Overall, this tender does not seem to be flood-related.",Non-Flood,success,
2024_ICD_38157_1,APL/CnP/Med/2024-25/312,PERIODICAL HEALTH CHECKUP FOR EMPLOYEES OF APL,PERIODICAL HEALTH CHECKUP FOR EMPLOYEES OF APL,Services,Open Tender,Item Rate,Miscellaneous Services,No,No,NA ,23-Jul-2024 04:00 PM,NA ,180.0,No ,No,Online,21-Aug-2024 03:00 PM,Industries and Commerce Department||Assam Petro-Chemicals Ltd.||Head office Namrup||Materials Management Department,"APL, Namrup",786623.0,2.0,,DR KAKADES PATHOLOGY LABORATORY,"490,500",Rejected-Finance,15-Oct-2024,Industries and Commerce Department||Assam Petro-Chemicals Ltd.||Head office Namrup||Materials Management Department,"The tender is for a 'PERIODICAL HEALTH CHECKUP FOR EMPLOYEES OF APL', which is a routine health-related activity and not directly related to flood management or prevention. The tender does not mention any flood-related keywords, infrastructure, or emergency response. The department involved is the Industries and Commerce Department, which is not typically associated with flood-related projects. Overall, there is no clear indication that this tender is for a flood-related project.",Non-Flood,success,
2024_ICD_38225_1,APL/CnP/Elect/2024-25/322,ANNUAL CONTRACT OF REGULAR MAINTENANCE OF HOUSEHOLD ELECTRICAL INSTALLATION. AND LT OVERHEAD LINE IN APL TOWNSHIP,ANNUAL CONTRACT OF REGULAR MAINTENANCE OF HOUSEHOLD ELECTRICAL INSTALLATION. AND LT OVERHEAD LINE IN APL TOWNSHIP,Works,Open Tender,Item Rate,Electrical Works,No,No,NA ,27-Jul-2024 01:00 PM,NA ,180.0,No ,No,Online,26-Aug-2024 03:00 PM,Industries and Commerce Department||Assam Petro-Chemicals Ltd.||Head office Namrup||Materials Management Department,Assam Petrochemicals Limited,786623.0,2.0,,M/S BAGLARI ELECTRICALS,"2,089,977",Accepted-AOC,01-Nov-2024,Industries and Commerce Department||Assam Petro-Chemicals Ltd.||Head office Namrup||Materials Management Department,"The tender is for the annual contract of regular maintenance of household electrical installations and LT overhead lines in the APL (Assam Petro-Chemicals Ltd.) township. It does not mention any flood-related works, infrastructure, or emergency response. The tender is for routine maintenance activities and does not appear to be specifically focused on flood protection, prevention, or restoration. There are no keywords or context indicating flood-related aspects.",Non-Flood,success,
2024_ICD_38319_1,ECF No.307834/113 dated 02.08.2024,"Utility area cleaning and maintenance at Industrial Estate, Amingaon","Utility area cleaning and maintenance at Industrial Estate, Amingaon",Works,Open Tender,Item Rate,Miscellaneous Works,No,No,NA ,02-Aug-2024 02:30 PM,NA ,120.0,No ,No,Online,21-Aug-2024 02:00 PM,Industries and Commerce Department||Assam Industrial Development Corporation Ltd - ICD,"Industrial Estate (EPIP), Amingaon",781031.0,2.0,"11,62,236",GANGA DHAR DAS,"903,961.8",Rejected-AOC,01-Nov-2024,Industries and Commerce Department||Assam Industrial Development Corporation Ltd - ICD,"The tender is for utility area cleaning and maintenance at an Industrial Estate in Amingaon. It does not mention any flood-related works or infrastructure, such as flood protection, embankments, drainage systems, or emergency response facilities. The tender also does not provide any context about the project being in a flood-prone area or related to flood management. The department involved is the Industries and Commerce Department, which is not typically associated with flood-related projects. Overall, there are no clear primary or secondary indicators that this tender is flood-related.",Non-Flood,success,
2024_ICD_38410_1,INS/BOF/DNPL/2024/207/03,ENGAGEMENT OF INSURER FOR BUILDING IN COURSE OF CONSTRUCTION POLICY OF DNP LTD,ENGAGEMENT OF INSURER FOR BUILDING IN COURSE OF CONSTRUCTION POLICY OF DNP LTD.,Services,Open Tender,Works,Miscellaneous Services,No,No,NA ,09-Aug-2024 03:00 PM,NA ,60.0,No ,No,Not Applicable,23-Aug-2024 03:00 PM,Industries and Commerce Department||DNP Limited,Duliajan,786602.0,2.0,,Future Generali India Insurance Compnay Limited,"1,200,160.23",Accepted-AOC,21-Oct-2024,Industries and Commerce Department||DNP Limited,"The tender is for the engagement of an insurer for a building in the course of construction policy for DNP Ltd. It does not mention any flood-related works, infrastructure, or emergency response. The department involved is the Industries and Commerce Department, which is not typically associated with flood management. There are no keywords or context indicating this is a flood-related project. Overall, this appears to be a standard construction-related tender without any flood mitigation or prevention components.",Non-Flood,success,
2024_ICD_38772_1,AAPL/CnP/ Civil/2024-25/340,"Cleaning of intake well, tube settlers basins, pipes and channels","Cleaning of intake well, tube settlers basins, pipes and channels",Works,Open Tender,Item Rate,Civil Works - Others,No,No,NA ,03-Sep-2024 03:00 PM,NA ,180.0,No ,No,Online,13-Sep-2024 03:00 PM,Industries and Commerce Department||Assam Petro-Chemicals Ltd.||Head office Namrup||Materials Management Department,Assam Petrochemicals limited,786623.0,2.0,,SHRI NITU SONOWAL,"591,200",Rejected-AOC,21-Oct-2024,Industries and Commerce Department||Assam Petro-Chemicals Ltd.||Head office Namrup||Materials Management Department,"The tender is for the cleaning of intake well, tube settlers basins, pipes and channels, which are part of the water management infrastructure. While this could be considered a flood-related activity, the tender does not explicitly mention any flood protection or prevention works. The department involved is the Industries and Commerce Department, which is not typically associated with flood management. Additionally, there is no mention of the tender being for pre-monsoon preparation or post-flood restoration work. Therefore, based on the information provided, the primary purpose of this tender appears to be routine maintenance and upkeep of the water infrastructure, rather than a specific flood-related project.",Non-Flood,success,
2024_ID_37653_1,DJD(I)D/G-8/2024-25/379 Date 14/06/2024,SOLAR POWERED MDTW SCHEME AT NO 3 NILAKH BALIJAN PATHAR and KAROI BARI PATHAR 1 POINT UNDER SOPD G FOR THE YEAR 2023 24,SOLAR POWERED MDTW SCHEME AT NO 3 NILAKH BALIJAN PATHAR and KAROI BARI PATHAR 1 POINT UNDER SOPD G FOR THE YEAR 2023 24,Works,Open Tender,Works,Civil Works,No,No,NA ,19-Jun-2024 05:00 PM,NA ,180.0,No ,No,Online,11-Jul-2024 11:00 AM,Irrigation Department||Chief Engineer(Major)-Irrigation Dept||Lakhimpur Circle,Dhemaji,787057.0,2.0,"34,65,687",ROHIT DOLEY,"3,119,118",Rejected-AOC,22-Oct-2024,Irrigation Department||Chief Engineer(Major)-Irrigation Dept||Lakhimpur Circle,"The tender is for a ""SOLAR POWERED MDTW SCHEME AT NO 3 NILAKH BALIJAN PATHAR and KAROI BARI PATHAR 1 POINT UNDER SOPD G FOR THE YEAR 2023 24"". It does not mention any flood-related works or infrastructure, such as embankments, dykes, or drainage systems. The project appears to be a regular solar-powered water supply scheme, which is not directly related to flood protection or mitigation. The department involved is the Irrigation Department, but the tender does not indicate any specific flood management focus. Overall, there are no clear primary or secondary indicators that this tender is for a flood-related project.",Non-Flood,success,
2024_ID_38660_1,S-JDI/T/32/2024/1022,Installation of Bilashipara Pathar Solar powered MDTW (1Point) Irrigation Scheme under SOPD-G for the year 2023-24.,Installation of Bilashipara Pathar Solar powered MDTW (1Point) Irrigation Scheme under SOPD-G for the year 2023-24.,Works,Open Tender,Item Rate,Civil Works,No,No,NA ,27-Aug-2024 06:00 PM,11-Sep-2024 02:00 PM ,180.0,No ,No,Online,17-Sep-2024 11:00 AM,Irrigation Department||Chief Engineer(Major)-Irrigation Dept||Barpeta Circle||Sorbhog Jania Division,Bilashipara Pathar,781317.0,2.0,"34,70,144",NUR UDDIN AHMED,"3,470,000",Rejected-Technical,29-Oct-2024,Irrigation Department||Chief Engineer(Major)-Irrigation Dept||Barpeta Circle||Sorbhog Jania Division,"The tender is for the installation of a solar-powered irrigation scheme under the SOPD-G (State Own Priority Development - General) program. While the tender mentions the location as Bilashipara Pathar, which could be in a flood-prone area, the primary purpose of the project is for irrigation and water management rather than flood protection or mitigation. There are no explicit references to flood-related infrastructure, emergency response, or flood damage restoration. The tender also does not mention any temporal factors like pre-monsoon preparation or post-flood restoration. Overall, the project appears to be a regular water management and irrigation development work, without a clear flood-related focus.",Non-Flood,success,
2024_ID_39411_1,NIT No. 15/2024-25,SOLAR POWERED MDTW IS AT NIRMALIA GAON and GHUGULONI GAON AT NAHARKATIA LAC (2 POINTS) UNDER SOPD-TSP FOR THE YEAR 2024-25,SOLAR POWERED MDTW I/S AT NIRMALIA GAON and GHUGULONI GAON AT NAHARKATIA LAC (2 POINTS) UNDER SOPD-TSP FOR THE YEAR 2024-25,Works,Open Tender,Works,Civil Works – Lift Irrigation Schemes,No,No,NA ,27-Sep-2024 04:30 PM,NA ,180.0,No ,No,Online,18-Oct-2024 02:30 PM,Irrigation Department||Chief Engineer(Minor Irrigation)-Irrigation Dept||Dibrugarh Circle,Naharkatia,786610.0,2.0,"70,95,346",M/s SONOWAL ASSOCIATE,"7,095,346.05",Not Admitted-Fee/PreQual/Technical,21-Oct-2024,Irrigation Department||Chief Engineer(Minor Irrigation)-Irrigation Dept||Dibrugarh Circle,,,failed,"Failed after 1 attempts: Error code: 429 - {'type': 'error', 'error': {'type': 'rate_limit_error', 'message': 'This request would exceed your organization’s rate limit of 50 requests per minute. For details, refer to: https://docs.anthropic.com/en/api/rate-limits; see the response headers for current usage. Please reduce the prompt length or the maximum tokens requested, or try again later. You may also contact sales at https://www.anthropic.com/contact-sales to discuss your options for a rate limit increase.'}}"
2024_ID_39414_1,16 /2024-25,INSTALLATION OF 2 POINTS OF MDTW IRRIGATION SCHEME UNDER BARBARUAH BLOCK AREA UNDER DIBRUGARH LAC UNDER SOPD-G FOR THE YEAR 2024-25,INSTALLATION OF 2 POINTS OF MDTW IRRIGATION SCHEME UNDER BARBARUAH BLOCK AREA UNDER DIBRUGARH LAC UNDER SOPD-G FOR THE YEAR 2024-25,Works,Open Tender,Turn-key,Civil Works – Lift Irrigation Schemes,No,No,NA ,27-Sep-2024 04:30 PM,NA ,180.0,No ,No,Online,18-Oct-2024 02:30 PM,Irrigation Department||Chief Engineer(Minor Irrigation)-Irrigation Dept||Dibrugarh Circle,Dibrugarh,786003.0,2.0,"70,95,507",SRI MRIDUL KUMAR SONOWAL,"7,095,507",Not Admitted-Fee/PreQual/Technical,21-Oct-2024,Irrigation Department||Chief Engineer(Minor Irrigation)-Irrigation Dept||Dibrugarh Circle,"The tender is for the installation of 2 points of MDTW (Medium Depth Tube Well) irrigation scheme under the Barbaruah block area in Dibrugarh district. While the tender mentions the project being under the SOPD-G (State Own Plan Scheme - General) for the year 2024-25, it does not explicitly state any flood-related purpose or context. The tender does not include any keywords or details indicating flood protection, prevention, or mitigation works. The department involved is the Irrigation Department, which suggests a focus on water management and irrigation rather than flood management. Overall, the tender appears to be for a routine irrigation infrastructure project and does not have a clear flood-related component.",Non-Flood,success,
2024_ID_39415_1,NIT No. 17/2024-25,SOLAR POWERED MDTW SCHEME AT NAKHAT AREA (3 POINTS) UNDER SOPD-G FOR THE YEAR 2024-25,SOLAR POWERED MDTW SCHEME AT NAKHAT AREA (3 POINTS) UNDER SOPD-G FOR THE YEAR 2024-25,Works,Open Tender,Turn-key,Civil Works – Lift Irrigation Schemes,No,No,NA ,27-Sep-2024 04:30 PM,NA ,180.0,No ,No,Online,18-Oct-2024 02:30 PM,Irrigation Department||Chief Engineer(Minor Irrigation)-Irrigation Dept||Dibrugarh Circle,Tingkhong,786612.0,2.0,"1,06,43,231",HEMANTA SAIKIA,"7,095,487.33",Accepted-AOC,22-Oct-2024,Irrigation Department||Chief Engineer(Minor Irrigation)-Irrigation Dept||Dibrugarh Circle,"The tender is for a ""SOLAR POWERED MDTW SCHEME AT NAKHAT AREA (3 POINTS) UNDER SOPD-G FOR THE YEAR 2024-25"". The description does not mention any flood-related works or infrastructure. The tender is for a solar-powered water supply scheme, which is a general development project and not specifically related to flood protection or mitigation. The department involved is the Irrigation Department, but the project does not appear to be a flood-related infrastructure or emergency response facility. There are no flood-related keywords or temporal factors indicating pre-monsoon or post-flood restoration work. Overall, the tender does not meet the criteria for a flood-related project.",Non-Flood,success,
2024_ID_39566_1,TC(I)-02/2024-25,Installation of Solar Powered MDTW (2 Pts) at Alubari and segunbari faltu gaon under SOPD -G for the year 2024-25,"Boring, installation and commissioning of 2 MDTW pts at Margherita LAC",Works,Open Tender,Item Rate,Construction Works,No,No,NA ,03-Oct-2024 03:00 PM,NA ,180.0,No ,No,Online,23-Oct-2024 01:30 PM,Irrigation Department||Chief Engineer(Major)-Irrigation Dept||Tinsukia Circle,Margherita LAC,786181.0,2.0,"70,95,072",M/s SONOWAL ASSOCIATE,"7,095,072",Rejected-Technical,25-Oct-2024,Irrigation Department||Chief Engineer(Major)-Irrigation Dept||Tinsukia Circle,"The tender is for the installation of solar-powered MDTW (Mini Drinking Water) points at two locations, Alubari and Segunbari, under the SOPD-G (State Own Plan Scheme - General) program. The work involves boring, installation, and commissioning of the MDTW points. The tender is issued by the Irrigation Department, specifically the Chief Engineer (Major) and the Tinsukia Circle.

While the tender mentions the locations as ""faltu gaon"" (meaning ""useless village"" in Assamese), it does not provide any direct indication of the project being flood-related. The tender does not mention any flood protection, prevention, or mitigation measures, nor does it reference flood-prone areas or emergency response facilities. The project appears to be a routine water infrastructure development initiative rather than a specific flood-related intervention.",Non-Flood,success,
2024_ID_39570_1,TC(I)-01/2024-25,Installation of solar operated MDTW Scheme (2 points) at Borpathar under SOPD-G for the year 2024-25,"Boring,installation ,commissioning of pump etc.",Works,Open Tender,Item Rate,Construction Works,No,No,NA ,03-Oct-2024 03:00 PM,NA ,180.0,No ,No,Online,23-Oct-2024 01:30 PM,Irrigation Department||Chief Engineer(Major)-Irrigation Dept||Tinsukia Circle,"Borpathar,Sadiya",786154.0,2.0,"70,95,072",SRI BULESWAR KACHARI,"7,095,072",Accepted-AOC,30-Oct-2024,Irrigation Department||Chief Engineer(Major)-Irrigation Dept||Tinsukia Circle,"The tender is for the installation of solar-operated MDTW (Mini Drinking Water) Scheme at Borpathar under SOPD-G (State Own Program for Development - General). While the tender mentions ""boring, installation, and commissioning of pump"", it does not explicitly indicate any flood-related works or infrastructure. The department involved is the Irrigation Department, but the project scope seems to be focused on water supply rather than flood management or prevention. There are no keywords or context suggesting this is a flood-related project. Therefore, based on the information provided, this tender is likely for a non-flood-related infrastructure development.",Non-Flood,success,
2024_ITFCD_39028_1,E-373598,Procurement of Architectural 3D Rendering Software,Supply and installation of Lumion Pro (1 Year subscription) or equivalent,Goods,Open Tender,Supply,Computer- S/W,No,No,NA ,18-Sep-2024 03:00 PM,NA ,180.0,No ,No,Not Applicable,27-Sep-2024 03:00 PM,Indigenous and Tribal Faith and Culture Department||Directorate of Museums,"Directorate of Museums, Assam",781001.0,2.0,"1,89,826",TRISITA ENGINEERING LLP,"178,416",Rejected-AOC,22-Oct-2024,Indigenous and Tribal Faith and Culture Department||Directorate of Museums,"The tender is for the procurement of architectural 3D rendering software, which is not directly related to flood protection, prevention, or management. The description mentions the supply and installation of Lumion Pro software, which is a general-purpose 3D visualization tool used in various architectural and design projects. There are no keywords or context indicating that this tender is specifically for flood-related infrastructure or emergency response. The department involved (Indigenous and Tribal Faith and Culture Department and Directorate of Museums) also does not suggest any flood management responsibilities. Overall, this tender appears to be for a standard software procurement and does not have a primary focus on flood-related activities.",Non-Flood,success,
