2024_PWD_35971_2,T/DRC/MMPPNA/2023-24/1434,MMPPNA_Dal_23-24_2 Construction of road from Kachamari Chapari to RowmariChapari to settlement No 2 at Shyampur No 4 (frm Ch. 0.00 km to Ch. 0.920 km) and Shyampur bazar Chowk (from Ch.0.00 km to 0.120 km) (L - 1.040 km),MMPPNA_Dal_23-24_2 Construction of road from Kachamari Chapari to RowmariChapari to settlement No 2 at Shyampur No 4 (frm Ch. 0.00 km to Ch. 0.920 km) and Shyampur bazar Chowk (from Ch.0.00 km to 0.120 km) (L - 1.040 km),Works,Open Tender,Works,Civil Works,No,No,NA ,06-Feb-2024 02:00 PM,08-Feb-2024 12:00 PM ,180.0,No ,No,Online,16-Feb-2024 01:00 PM,Public Works Roads Department,Mangaldoi,784125.0,2.0,"1,33,52,000",RUPAMJIT SAHARIA,"13,351,200",Rejected-AOC,05-Nov-2024,Public Works Roads Department,"The tender is for the construction of a road from Kachamari Chapari to Rowmari Chapari to settlement No 2 at Shyampur No 4 and Shyampur bazar Chowk. While the tender mentions the construction of roads in an area that may be prone to flooding, there are no explicit references to flood protection, prevention, or mitigation measures. The tender appears to be for regular road construction and maintenance work, rather than a specialized flood-related infrastructure project. The department involved is the Public Works Roads Department, which suggests a focus on general infrastructure development rather than flood management. Overall, the tender does not seem to be primarily focused on flood-related activities.",Non-Flood,success,
2024_PWD_35971_3,T/DRC/MMPPNA/2023-24/1434,MMPPNA_Dal_23-24_3 Construction of road from Kachamari Chapari to RowmariChapari to settlement No 3 at Shyampur No 3 (from Ch. 0.00 km to Ch. 1.60 km) (L- 1.600 km),MMPPNA_Dal_23-24_3 Construction of road from Kachamari Chapari to RowmariChapari to settlement No 3 at Shyampur No 3 (from Ch. 0.00 km to Ch. 1.60 km) (L- 1.600 km),Works,Open Tender,Works,Civil Works,No,No,NA ,06-Feb-2024 02:00 PM,08-Feb-2024 12:00 PM ,180.0,No ,No,Online,16-Feb-2024 01:00 PM,Public Works Roads Department,Mangaldoi,784125.0,2.0,"1,55,36,000",MD AFSAR ALI,"15,533,855",Rejected-AOC,05-Nov-2024,Public Works Roads Department,"The tender is for the construction of a road from Kachamari Chapari to Rowmari Chapari to settlement No 3 at Shyampur No 3. While the tender mentions the construction is in a flood-prone area, it does not explicitly state that the purpose of the project is for flood protection or mitigation. The tender does not mention any flood-related keywords such as embankment, dyke, or drainage system. The project appears to be a regular road construction work, which could be considered a secondary indicator of flood-related infrastructure. However, without more specific details on the project's objectives or the geographic context, it is difficult to determine if this is a flood-related project.",Ambiguous,success,
2024_PWD_35971_4,T/DRC/MMPPNA/2023-24/1434,MMPPNA_Dal_23-24_4 Construction of road from Shyampur No 2 to KheroniParghat Road to settlement No 4 (from Ch. 0.00 km to Ch. 2.50 km) 9L-2.50 km),MMPPNA_Dal_23-24_4 Construction of road from Shyampur No 2 to KheroniParghat Road to settlement No 4 (from Ch. 0.00 km to Ch. 2.50 km) 9L-2.50 km),Works,Open Tender,Works,Civil Works,No,No,NA ,06-Feb-2024 02:00 PM,08-Feb-2024 12:00 PM ,180.0,No ,No,Online,16-Feb-2024 01:00 PM,Public Works Roads Department,Mangaldoi,784125.0,2.0,"2,28,24,000",KULEN HAZARIKA,"22,817,385",Accepted-AOC,05-Nov-2024,Public Works Roads Department,"The tender is for the construction of a road from Shyampur No 2 to KheroniParghat Road to settlement No 4, which does not appear to be directly related to flood protection or prevention. The tender does not mention any flood-related keywords, such as embankment construction, drainage systems, or erosion control. The department involved is the Public Works Roads Department, which suggests this is a regular road construction project rather than a flood-related infrastructure work. There is also no information provided about the project's location being in a flood-prone area or the timing of the work in relation to the monsoon season. Overall, the tender details do not indicate a primary focus on flood-related activities.",Non-Flood,success,
2024_PWD_36363_4,CE/DEV/TB/906/2023-24/04,SOPD_ODS_23_24_140 Improvement of Tea Garden Roads at Deroi T.E (Pithaguti Division) (Ch. 0.00m to Ch. 1390.00m) under SOPD-ODS (Tea Garden Road) for the year 2023-24.,SOPD_ODS_23_24_140 Improvement of Tea Garden Roads at Deroi T.E (Pithaguti Division) (Ch. 0.00m to Ch. 1390.00m) under SOPD-ODS (Tea Garden Road) for the year 2023-24.,Works,Open Tender,Item Rate,Civil Works,No,No,NA ,19-Feb-2024 03:55 PM,29-Feb-2024 12:00 PM ,180.0,No ,No,Online,20-Mar-2024 02:00 PM,Public Works Roads Department,Dibrugarh,781003.0,2.0,"81,90,000",M/S S.K. ENTERPRISE,"8,187,000",Accepted-AOC,25-Nov-2024,Public Works Roads Department,"The tender is for the improvement of tea garden roads in the Deroi T.E (Pithaguti Division) under the SOPD-ODS (Tea Garden Road) program. While the tender mentions the improvement of roads, it does not explicitly state any flood-related work or infrastructure. There are no keywords or context indicating flood protection, prevention, or mitigation. The tender also does not mention any temporal factors like pre-monsoon preparation or post-flood restoration. The project appears to be a regular road improvement work under the Public Works Roads Department, without a specific focus on flood-related aspects.",Non-Flood,success,
2024_PWD_36371_2,CE/NEC/2021-22/01/87,Road and Bridge Works,Construction of new road from Chowkihola to Tarapung via Borpung (Chowkihola- Arlongwoti road with one major bridge over river Kaliyani) under NESIDS,Works,Open Tender,Lump-sum,Civil Works,No,No,NA ,17-Feb-2024 06:00 PM,20-Feb-2024 12:00 PM ,180.0,No ,No,Online,06-Mar-2024 02:00 PM,Public Works Roads Department,Karbianglong,781003.0,2.0,,Shree Gautam Construction Co. Ltd.,"1,965,100,000",Not Admitted-Fee/PreQual/Technical,21-Nov-2024,Public Works Roads Department,"The tender describes the construction of a new road and a major bridge over the Kaliyani river, which suggests that this project is focused on improving transportation infrastructure rather than direct flood protection or prevention. While the project is located in a flood-prone area, the primary purpose appears to be general infrastructure development rather than flood-related works. There are no explicit mentions of flood-related keywords such as embankments, dykes, or drainage systems. The tender also does not provide any information about the project's timing in relation to the monsoon season or emergency response. Overall, the details provided indicate that this is a non-flood-related infrastructure project.",Non-Flood,success,
2024_PWD_36432_5,CE/DEV/TB/906/2023-24/07,SOPD_ODS_23_24_113 Construction of Road from Khobang Babu Line to Daisa Balijan LP School under SOPD-ODS (Tea Garden Road) for the year 2023-24.,SOPD_ODS_23_24_113 Construction of Road from Khobang Babu Line to Daisa Balijan LP School under SOPD-ODS (Tea Garden Road) for the year 2023-24.,Works,Open Tender,Item Rate,Civil Works,No,No,NA ,19-Feb-2024 05:55 PM,20-Feb-2024 12:00 PM ,180.0,No ,No,Online,26-Feb-2024 02:00 PM,Public Works Roads Department,Tinsukia,781003.0,2.0,"1,38,41,000",SRI SWADIP GOHAIN,"13,608,565",Rejected-AOC,04-Nov-2024,Public Works Roads Department,"The tender is for the construction of a road from Khobang Babu Line to Daisa Balijan LP School under the SOPD-ODS (Tea Garden Road) program for the year 2023-24. The project is being undertaken by the Public Works Roads Department. The tender does not mention any specific flood-related aspects, such as flood protection works, embankment construction, or drainage systems in flood-prone areas. The description suggests a regular road construction project, without any clear indication of it being a flood-related infrastructure or development work. There are no keywords or context that would suggest this is a flood-mitigation or flood-response project.",Non-Flood,success,
2024_PWD_36432_6,CE/DEV/TB/906/2023-24/07,SOPD_ODS_23_24_115 Construction of Road from Talap TE Khelmati Bangla to Talap TEhospital road under SOPD ODS (Tea Garden Road) for the year 2023-24.,SOPD_ODS_23_24_115 Construction of Road from Talap TE Khelmati Bangla to Talap TEhospital road under SOPD ODS (Tea Garden Road) for the year 2023-24.,Works,Open Tender,Item Rate,Civil Works,No,No,NA ,19-Feb-2024 05:55 PM,20-Feb-2024 12:00 PM ,180.0,No ,No,Online,26-Feb-2024 02:00 PM,Public Works Roads Department,Tinsukia,781003.0,2.0,"1,01,88,000",MS UDAY ENTERPRISE,"10,188,000",Accepted-AOC,04-Nov-2024,Public Works Roads Department,"The tender is for the construction of a road from Talap TE Khelmati Bangla to Talap TE hospital road under the SOPD ODS (Tea Garden Road) program for the year 2023-24. The tender is issued by the Public Works Roads Department, which is not a specialized flood management agency. The description does not mention any flood-related keywords or context, such as flood protection, embankment construction, or drainage systems in flood-prone areas. The tender appears to be for a regular road construction project, without any specific focus on flood-related infrastructure or emergency response. Therefore, based on the information provided, this tender is likely for a non-flood-related project.",Non-Flood,success,
2024_PWD_37222_1,Dibrugarh/CRIF/2023-24/02,Dibrugarh/CRIF/2023-24/02 Construction of RCC Bridge over River Buridehing at Romaighat including Approaches and Protection work in Lahowal LAC,Dibrugarh/CRIF/2023-24/02 Construction of RCC Bridge over River Buridehing at Romaighat including Approaches and Protection work in Lahowal LAC (Bridge Length 360m (6X60m).,Works,Open Tender,Item Rate,Civil Works,No,No,NA ,14-Mar-2024 04:50 PM,27-Mar-2024 04:00 PM ,180.0,No ,No,Online,04-Apr-2024 11:00 AM,Public Works Roads Department,Dibrugarh,786001.0,2.0,"61,59,35,000",SHREE GAUTAM CONSTRUCTION CO. LTD.,"579,118,639",Rejected-Finance,16-Nov-2024,Public Works Roads Department,"The tender is for the construction of an RCC bridge over the River Buridehing at Romaighat, including approaches and protection work. The project is located in a flood-prone area and involves the construction of a significant bridge infrastructure. The description mentions the bridge length of 360m, indicating a large-scale flood-related project. The department involved is the Public Works Roads Department, which suggests this is a flood mitigation and infrastructure project rather than a routine road construction. The tender details indicate this is a pre-monsoon preparation work, further supporting the flood-related classification.",Flood,success,
2024_PWD_37257_1,No. CE/DEV/TB/906/2023-24/17,SOPD_ODS_23_24_19 Construction of Nahartoli T.E. Road from Ch. 0.00m to 1300.00m (Total Length 1.30 Km) under SOPD-ODS (Tea Garden Road) for the year 2023-24,SOPD_ODS_23_24_19 Construction of Nahartoli T.E. Road from Ch. 0.00m to 1300.00m (Total Length 1.30 Km) under SOPD-ODS (Tea Garden Road) for the year 2023-24,Works,Open Tender,Item Rate,Civil Works,No,No,NA ,14-Mar-2024 05:00 PM,20-Mar-2024 12:00 PM ,180.0,No ,No,Online,28-Mar-2024 02:00 PM,Public Works Roads Department,Dibrugarh,781003.0,2.0,"1,08,23,000",M/S S.K. ENTERPRISE,"10,822,800",Not Admitted-Fee/PreQual/Technical,25-Nov-2024,Public Works Roads Department,"The tender is for the construction of Nahartoli T.E. Road, which is a road infrastructure project under the SOPD-ODS (Tea Garden Road) program. While the tender mentions the construction of a road in a flood-prone area, it does not explicitly state that the primary purpose is flood protection or mitigation. The tender also does not mention any flood-related keywords such as embankment, dyke, or drainage system. The project seems to be a regular road construction work, and there is no indication of it being a pre-monsoon preparation or post-flood restoration activity. Therefore, based on the information provided, this tender is more likely to be a non-flood-related infrastructure project.",Non-Flood,success,
2024_PWD_37640_3,CE/Maint/MMPPNA/01/2023-24/37,Maint/MMPPNA/2023-24/221,"Construction of Dinaram Das Path at Rajaduar,Ward No. 9 of Noth Guwahati MB , Madhab Barua Path at Rajaduar,Ward No. 9 of Noth Guwahati MB ,Gopal Mandir Path at Cutting Pahar Ward No. 1 of Noth Guwahati MB , Byelane no. 1 and 4 of Barkakti Path at",Works,Open Tender,Item Rate,Civil Works – Roads,No,No,NA ,18-Jun-2024 02:00 PM,20-Jun-2024 12:00 PM ,180.0,No ,No,Online,03-Jul-2024 03:00 PM,Public Works Roads Department,Kamrup metro,781001.0,2.0,,Latifuddin Ahmed,"15,645,000",Accepted-AOC,21-Nov-2024,Public Works Roads Department,"The tender is for the construction of various paths and byelanes in North Guwahati, Assam. While the description mentions locations that may be prone to flooding, the primary purpose of the work appears to be general infrastructure development and maintenance, rather than specific flood-related measures. There are no explicit mentions of flood protection, prevention, or mitigation works. The tender also does not provide any information about the timing or urgency of the project, which could indicate a pre-monsoon or post-flood context. Overall, the tender details do not strongly suggest a flood-related classification.",Non-Flood,success,
2024_PWD_38264_1,Dibrugarh/CRIF/2023-24/04,Dibrugarh/CRIF/2023-24/04 Widening and Strengthening of old NH 37,Dibrugarh/CRIF/2023-24/04 Widening and Strengthening of old NH 37 at Ch 598.976Km Seujpur to Ch. 618.60 Km Nadua TE and Ch. 633.60Km Panitula to Ch.636.80 Km Laipuli total length 22.824 km.,Works,Open Tender,Item Rate,Civil Works – Roads,No,No,NA ,31-Jul-2024 11:00 AM,02-Aug-2024 02:00 PM ,180.0,No ,No,Online,07-Aug-2024 12:00 PM,Public Works Roads Department,Dibrugarh,786001.0,2.0,"65,60,79,000",SHREE GAUTAM CONSTRUCTION CO. LTD.,"590,471,100",Rejected-Finance,16-Nov-2024,Public Works Roads Department,"The tender is for the widening and strengthening of a section of the old NH 37 in Dibrugarh, Assam. While the description mentions the specific chainage and length of the road work, it does not explicitly state that this is a flood-related project. The tender does not contain any primary indicators such as direct flood protection/prevention works, flood damage restoration, or flood-related infrastructure like embankments or dykes. The secondary indicators, such as road/bridge repairs mentioning rain/water damage or erosion control measures, are also not clearly present. The temporal factors, such as pre-monsoon preparation works or post-flood restoration, are also not specified. Overall, the tender appears to be for a regular road construction and maintenance project, without a clear flood-related purpose or context.",Non-Flood,success,
2024_PWD_38536_3,CE/Maint/MMPNA/01/2023-24/37,MMPNA/2023-24/244,"MMPNA/2023-24/244_Periodic Renewal of Sarboibandha Krishna Nagar Muktiyaodha Path from Ch. 0.00m to 1000.00m , Desoikosh Bamungaon Road from1.00Km to 4.46km, Malow Ali to Gorokhiadole link road Na_Ali from Ch.0.00Km to 0.75km andPuranmati Satra Road",Works,Open Tender,Item Rate,Civil Works – Roads,No,No,NA ,19-Aug-2024 02:00 PM,21-Aug-2024 12:00 PM ,180.0,No ,No,Online,29-Aug-2024 11:00 AM,Public Works Roads Department,Teok,781003.0,2.0,"1,04,34,000",Md Firoz Khan,"10,434,000",Accepted-AOC,04-Nov-2024,Public Works Roads Department,"The tender describes periodic renewal and maintenance work on several roads, including Sarboibandha Krishna Nagar Muktiyaodha Path, Desoikosh Bamungaon Road, Malow Ali to Gorokhiadole link road, and Puranmati Satra Road. While the tender mentions that these roads are in flood-prone areas, the primary purpose of the work appears to be routine maintenance and renewal rather than specific flood protection or mitigation measures. There are no explicit references to flood-related infrastructure like embankments, dykes, or drainage systems. The tender also does not mention any temporal factors like pre-monsoon preparation or post-flood restoration. Overall, the tender seems to be focused on general road infrastructure improvements rather than flood-related works.",Non-Flood,success,
2024_PWD_38724_1,CE/Maint/MMPPNA/01/2023-24/41,Maint/MMPPNA/2023-24/136,Maint/MMPPNA/2023-24/136_Construction of Road from Karchowabori to Goroimari from Ashigar to Hasnabori Road including Four years maintenance under MMPPNA for the year 2023_24 in Morigaon District,Works,Open Tender,Item Rate,Civil Works – Roads,No,No,NA ,31-Aug-2024 02:00 PM,02-Sep-2024 12:00 PM ,180.0,No ,No,Online,13-Sep-2024 11:00 AM,Public Works Roads Department,Morigaon,781003.0,2.0,"2,35,08,000",BARUN AGARWALA,"23,507,500",Accepted-AOC,19-Nov-2024,Public Works Roads Department,"The tender is for the construction of a road from Karchowabori to Goroimari, including four years of maintenance, under the MMPPNA (Morigaon Maa Kamakhya Prakalpa Nari Abhiyan) program in Morigaon District. While the tender does not explicitly mention flood-related works, the location in Morigaon District, which is prone to flooding, and the inclusion of road construction and maintenance, suggest that this project may have a flood mitigation or resilience component. However, the tender does not provide clear details on the specific flood-related aspects of the project, such as the inclusion of flood protection infrastructure or drainage systems. Therefore, the classification is ambiguous based on the information provided.",Ambiguous,success,
2024_PWD_38931_1,CS/DDTRD/SOPD-G/1/2024-25,CRC-DDTRD-194- Uday Nagar and Giri Nagar,"Improvement of Uday Nagar and Giri Nagar link road at Dakhingaon, Kahilipara under Dispur LAC under SOPD_G for the year 2024-25.",Works,Open Tender,Works,Civil Works,No,No,NA ,12-Sep-2024 10:00 AM,NA ,180.0,No ,No,Online,16-Sep-2024 02:00 PM,Public Works Roads Department,Kamrup,781021.0,2.0,"51,60,000",Prakash Kumar Medhi,"5,159,790",Not Admitted-Fee/PreQual/Technical,04-Nov-2024,Public Works Roads Department,"The tender describes the improvement of a link road in Uday Nagar and Giri Nagar, which are located in Dakhingaon, Kahilipara under Dispur LAC. The work is being carried out under the SOPD_G (State Own Plan Scheme) for the year 2024-25. While the tender does not explicitly mention flood-related keywords, the location in Dakhingaon and Kahilipara suggests that the area may be prone to flooding. The improvement of the link road could potentially help with flood mitigation and management, but the primary purpose appears to be general infrastructure development rather than a dedicated flood-related project. There is no clear indication of the work being an emergency response or pre-monsoon preparation.",Ambiguous,success,
2024_PWD_39443_1,CE/STBR/II/24/2024-25/01 Dated 10/09/2024,"3rd Party Monitoring and Quality Control for the work Construction of Flyover near Downtown Hospital on Guwahati-Shillong Road in Guwahati, Assam","3rd Party Monitoring and Quality Control for the work Construction of Flyover near Downtown Hospital on Guwahati-Shillong Road in Guwahati, Assam",Works,Open Tender,Item Rate,Civil Works – Roads,No,No,NA ,28-Sep-2024 05:00 PM,NA ,180.0,No ,No,Online,08-Oct-2024 04:00 PM,Public Works Roads Department,Guwahati,781006.0,2.0,"73,72,000",THE DESIGN ROOM,"7,354,000",Rejected-AOC,28-Nov-2024,Public Works Roads Department,"The tender is for 3rd Party Monitoring and Quality Control for the construction of a flyover near a hospital on the Guwahati-Shillong Road in Guwahati, Assam. While the location is in Guwahati, which is prone to flooding, the tender does not mention any flood-related aspects or the purpose of the flyover construction. The tender is for a regular infrastructure project and does not appear to be specifically focused on flood protection, prevention, or mitigation. There are no flood-related keywords or context provided in the tender details.",Non-Flood,success,
2024_PWD_39685_1,SE/MRC/TB/NIT/01/2023-24/17,Package No. MRC/TAC/2024-25/04 (Gr-II),1.Construction of C C block (Paver block) from Baliadhipa CC Charch to Gidiyon Murmu House at Baliadhipa. 2.Construction of C C block (Paver block) road from Kondoli Bamuni PWD road to Bamuni Karbigaon,Works,Open Tender,Item Rate,Civil Works – Roads,No,No,NA ,07-Oct-2024 10:00 AM,NA ,180.0,No ,No,Online,16-Oct-2024 10:00 AM,Public Works Roads Department||CE PWD(R) - PWD,Morigaon,782105.0,2.0,"49,13,000",UTPAL KUMAR GOSWAMI,"4,912,462",Rejected-Finance,19-Nov-2024,Public Works Roads Department||CE PWD(R) - PWD,"The tender details mention the construction of CC block (paver block) roads in two locations - from Baliadhipa CC Church to Gidiyon Murmu House, and from Kondoli Bamuni PWD road to Bamuni Karbigaon. These appear to be regular road construction and improvement projects, rather than specific flood-related infrastructure or flood damage restoration works. The tender does not mention any flood protection, prevention, or management components. Additionally, the department involved is the Public Works Roads Department, which suggests a focus on general infrastructure development rather than flood-related activities. Based on the information provided, this tender does not seem to be primarily focused on flood-related works.",Non-Flood,success,
2024_PWD_39694_1,SE/MRC/TB/NIT/01/2023-24/17,Package No. MRC/TAC/2024-25/04 (Gr-VI),1.Bamuni Ahomgaon Playground to Lachit Bordoloi Fishary at Ahomgaon. 2.Borlalung gaon daily market to LP School. 3.NH-36 Gurguri Bridge to Ambu Deka House,Works,Open Tender,Item Rate,Civil Works – Roads,No,No,NA ,07-Oct-2024 10:00 AM,NA ,180.0,No ,No,Online,16-Oct-2024 10:00 AM,Public Works Roads Department||CE PWD(R) - PWD,Morigaon,782105.0,2.0,"73,68,000",Paban Saikia,"7,368,000",Not Admitted-Fee/PreQual/Technical,18-Nov-2024,Public Works Roads Department||CE PWD(R) - PWD,"The tender details mention several infrastructure projects, including the construction of a playground, a daily market, and repairs to a bridge. While some of these projects may be located in flood-prone areas, the tender does not explicitly mention any flood-related works or the purpose of flood protection/prevention. The department involved is the Public Works Roads Department, which suggests a focus on general infrastructure development rather than specialized flood management. Without any clear flood-related keywords or context, this tender appears to be for non-flood-related infrastructure projects.",Non-Flood,success,
2024_PWD_39697_1,SE/MRC/TB/NIT/01/2023-24/17,Package No. MRC/TAC/2024-25/04 (Gr-VII),"1.Boliram Bordoloi House to Putul Bordoloi House, 2.Kamarpara Shiv Mandir to Nara Doimari House at Kamarpara, 3.from Gomariati Kondoli pwd road to Arabari Kro Hem",Works,Open Tender,Item Rate,Civil Works – Roads,No,No,NA ,07-Oct-2024 10:00 AM,NA ,180.0,No ,No,Online,16-Oct-2024 10:00 AM,Public Works Roads Department||CE PWD(R) - PWD,Morigaon,782105.0,2.0,"73,69,000",UTPAL KUMAR GOSWAMI,"7,368,156",Rejected-Finance,19-Nov-2024,Public Works Roads Department||CE PWD(R) - PWD,"The tender details mention works related to road repairs and construction in various locations, including Boliram Bordoloi House to Putul Bordoloi House, Kamarpara Shiv Mandir to Nara Doimari House, and from Gomariati Kondoli PWD road to Arabari Kro Hem. While these areas may be prone to flooding, the tender does not explicitly mention any flood-related works or infrastructure. The description focuses on general road and infrastructure maintenance, without specific references to flood protection, drainage systems, or other flood-mitigation measures. The department involved is the Public Works Roads Department, which suggests a focus on regular road maintenance and construction rather than specialized flood-related projects. Additionally, the tender does not provide any information about the timing or urgency of the works, which could indicate pre-monsoon or post-flood restoration activities. Overall, the tender details do not provide clear evidence of flood-related classification.",Non-Flood,success,
2024_PWD_39708_1,SE/MRC/TB/NIT/01/2023-24/17,Package No.MRC/ TAC/2024-25/05 (Gr-III),"1.Road of Erabari panechia link road, 2.Road from Milonpur Namghar chok to the approach road of Sonapur Collage",Works,Open Tender,Item Rate,Civil Works – Roads,No,No,NA ,07-Oct-2024 10:00 AM,NA ,180.0,No ,No,Online,16-Oct-2024 10:00 AM,Public Works Roads Department||CE PWD(R) - PWD,Morigaon,782105.0,2.0,"75,60,000",APWRD/R/1A/GEN/2021-22/1313,"7,860,000",Accepted-AOC,18-Nov-2024,Public Works Roads Department||CE PWD(R) - PWD,"The tender details mention road construction and repair works, including a road from Milonpur Namghar chok to the approach road of Sonapur College, and the Erabari panechia link road. While the description does not explicitly mention flood-related aspects, the location of these roads in potentially flood-prone areas suggests that the works may have some flood mitigation or prevention components. However, the tender does not provide clear evidence of the primary purpose being flood-related infrastructure or emergency response. The department involved is the Public Works Roads Department, which is not typically associated with dedicated flood management projects. Overall, the classification is ambiguous, as the tender could be for routine road maintenance or repairs, with some incidental flood-related benefits, but the flood-prevention aspect is not the primary focus.",Ambiguous,success,
