2024_AHVD_37258_1,VCP/1/46/2024-25,Hiring of Vehicles for the FY 2024-2025,Hiring of Vehicles for the FY 2024-2025,Services,Open Tender,Item Wise,Miscellaneous Services,No,No,NA ,14-Mar-2024 05:00 PM,19-Mar-2024 11:00 AM ,180.0,No ,No,Online,11-Apr-2024 04:00 PM,Animal Husbandry and Veterinary Department||Directorate of A.H. and Veterinary,Assam,781003.0,2.0,,MOHAN MAHATO,"43,800",Rejected-Finance,19-Sep-2024,Animal Husbandry and Veterinary Department||Directorate of A.H. and Veterinary,"The tender is for hiring vehicles for the Animal Husbandry and Veterinary Department, which does not indicate any direct flood-related purpose. The description and title of the tender are also generic and do not mention any flood protection, prevention, or mitigation works. There are no keywords or context related to floods, flood-prone areas, or flood-related infrastructure. This appears to be a routine administrative tender for vehicle hiring, not a specialized flood-related project.",Non-Flood,success,
2024_APDCL_35514_1,GM /DZ/APDCL/UAR/2023-24/ M/S BORLUIT TEA PVT LTD /97,"UPGRADATION FROM 11/0.43 KV, 63 KVA POLE MOUNTED S/S TO 11/0.43 KV, 500 KVA PAD MOUNTED S/S AND CONSTRUCTION OF 11 KV SPUR LINE 40 METER LONG AAAC COVERED CONDUCTOR IN RESPECT OF M/S BORLUIT TEA PVT LTD, BRAHMAJAN","UPGRADATION FROM 11/0.43 KV, 63 KVA POLE MOUNTED S/S TO 11/0.43 KV, 500 KVA PAD MOUNTED S/S AND CONSTRUCTION OF 11 KV SPUR LINE 40 METER LONG AAAC COVERED CONDUCTOR IN RESPECT OF M/S BORLUIT TEA PVT LTD, BRAHMAJAN",Works,Open Tender,Turn-key,Electrical Works,No,Yes,NA ,17-Jan-2024 05:00 PM,,90.0,No ,No,Online,25-Jan-2024 02:00 PM,Assam Power Distribution Company Ltd||CGM(D) Upper Assam Region - APDCL||GM(Dibrugarh Zone) - APDCL,"BRAHMAJAN, Tinsukia",786125.0,2.0,,Nishtha Enterprises,"950,625.7",Rejected-AOC,28-Aug-2024,Assam Power Distribution Company Ltd||CGM(D) Upper Assam Region - APDCL||GM(Dibrugarh Zone) - APDCL,"The tender is for the upgradation of an existing 11/0.43 kV, 63 kVA pole-mounted substation to a 11/0.43 kV, 500 kVA pad-mounted substation, along with the construction of a 11 kV spur line. This work is being carried out for a private tea company, M/S Borluit Tea Pvt Ltd, in the Brahmajan area. The tender does not mention any flood-related keywords or context, and there is no indication that the work is specifically for flood protection or mitigation. The project appears to be a routine infrastructure upgrade rather than a flood-related initiative. Therefore, based on the information provided, this tender is classified as non-flood-related.",Non-Flood,success,
2024_APDCL_36490_1,APDCL/LAR/NDC/NER/23_24/T_124,"Construction of dedicated 33 KV line and installation of Substation in favour of National Data Centre for North Eastern Region, Amingaon","Construction of dedicated 33 KV line and installation of 3x 2.5 MVA , 33/0.433 KV Substation in favour of National Data Centre for North Eastern Region, Amingaon under Amingaon ESD",Works,Open Tender,Turn-key,Electrical Works,No,No,NA ,22-Feb-2024 09:00 AM,26-Feb-2024 11:00 AM ,180.0,No ,No,Online,07-Mar-2024 09:00 AM,Assam Power Distribution Company Ltd||CGM(D) Lower Assam Region - APDCL,Amingaon,781031.0,2.0,,Win Power Infracon LLP,"105,892,174.28",Rejected-Technical,22-Oct-2024,Assam Power Distribution Company Ltd||CGM(D) Lower Assam Region - APDCL,"The tender is for the construction of a dedicated 33 KV line and installation of a 3x 2.5 MVA, 33/0.433 KV substation in favor of the National Data Centre for the North Eastern Region in Amingaon. The project is being undertaken by the Assam Power Distribution Company Ltd (APDCL), which is not a typical flood management agency. The tender does not mention any flood-related keywords or context, and the primary purpose appears to be the construction of regular power infrastructure to support the National Data Centre. There are no indications of the project being a flood protection or mitigation measure. Therefore, this tender is likely for a non-flood-related infrastructure development project.",Non-Flood,success,
2024_APDCL_38579_2,NZBSNGHTMRG,R and M Basanaghat DSS,Construction and installation of required switchyard equipments for 2nos of 11kV outgoing feeders at Basanaghat Sub-Station under Morigaon Electrical Sub-Division of Morigaon Electrical Circle,Works,Open Tender,Turn-key,Electrical Works,No,No,NA ,03-Sep-2024 05:00 PM,NA ,90.0,No ,No,Online,25-Sep-2024 02:00 PM,Assam Power Distribution Company Ltd||CGM(D) Central Assam Region - APDCL||GM(Nagaon Zone) - APDCL,Morigaon Electrical Circle,782001.0,2.0,,HAZARIKA ELECTRICALS,"2,899,485.33",Rejected-Technical,08-Oct-2024,Assam Power Distribution Company Ltd||CGM(D) Central Assam Region - APDCL||GM(Nagaon Zone) - APDCL,"The tender is for the construction and installation of required switchyard equipment for 2 outgoing 11kV feeders at the Basanaghat Sub-Station under the Morigaon Electrical Sub-Division. The description does not mention any flood-related aspects, such as flood protection, prevention, or restoration works. The tender appears to be for routine maintenance and infrastructure upgrades, rather than specific flood-related projects. There are no keywords or context indicating this is a flood-related tender.",Non-Flood,success,
2024_APGCL_35856_1,Water Pipe Line-NTPS 51,"Supply, Erection and Commissioning of Water Supply Pipe Line","Supply, Erection and Commissioning of Water Supply Pipe Line from DM Plant Area to WHP and Pahar Line Colony at Namrup Thermal Power Station, APGCL, Namrup.",Works,Open Tender,Tender cum Auction,Civil Works - Water Works,No,No,NA ,01-Feb-2024 06:00 PM,NA ,180.0,No ,No,Online,01-Mar-2024 12:00 PM,Assam Power Generation Company Limited,Namrup Thermal Power Station,786622.0,2.0,,PARBATPUR TRADES,"2,475,571",Rejected-Finance,24-Oct-2024,Assam Power Generation Company Limited,"The tender is for the ""Supply, Erection and Commissioning of Water Supply Pipe Line"" at the Namrup Thermal Power Station. While the project involves water infrastructure, there is no explicit mention of flood-related work or flood mitigation. The tender does not contain any keywords or context indicating it is a flood-related project. The department involved is the Assam Power Generation Company Limited, which is not typically associated with flood management. Overall, the primary purpose of the work appears to be regular water supply infrastructure development rather than flood-related activities.",Non-Flood,success,
2024_APHC_37638_1,APHC/CS/70/2023-24_TezpurPS,"Construction of RCC S 4 L/S qtr 16 unit/bldg - Civil, Sanitary and water supply, Site development etc at Tezpur PS under the scheme for Special Assistance to the States for Capital Investment 23 - 24 on EPC Mode.","Construction of RCC S 4 L/S qtr 16 unit/bldg - Civil, Sanitary and water supply, Site development etc at Tezpur PS under the scheme for Special Assistance to the States for Capital Investment 23 - 24 on EPC Mode.",Works,Open Tender,Item Rate,Composite Works,No,No,NA ,21-Jun-2024 02:00 PM,27-Jun-2024 02:00 PM ,180.0,No ,No,Online,19-Jul-2024 02:30 PM,Assam Police Housing Corporation Ltd,Tezpur P.S. in Sonitpur Dist.,784001.0,2.0,"7,02,02,550",atw india pvt ltd,"70,000,000",Accepted-AOC,22-Oct-2024,Assam Police Housing Corporation Ltd,"The tender is for the construction of RCC S 4 L/S quarters (16 units/building) at Tezpur Police Station, including civil, sanitary, water supply, and site development works. The project is under the scheme for Special Assistance to the States for Capital Investment 2023-24 on EPC (Engineering, Procurement, and Construction) mode. While the tender mentions ""site development"", it does not explicitly state any flood-related components or considerations, such as flood protection, drainage systems, or erosion control measures. The department involved is the Assam Police Housing Corporation Ltd, which is not typically associated with flood management projects. Additionally, the tender does not provide any information about the project's location being in a flood-prone area or the timing of the work in relation to the monsoon season. Therefore, based on the available information, this tender appears to be for a regular construction project and not specifically related to flood-related infrastructure or development.",Non-Flood,success,
2024_APHC_37642_1,APHC/CS/68/2023-24_LangkashiOP,"Construction of Assam Type Outpost Building including Civil works, Electrical works, Sanitary (internal and External), Site Development works in Existing Langkashi OP under Bordubi PS, Tinsukia District of Assam. (Composite Work)","Construction of Assam Type Outpost Building including Civil works, Electrical works, Sanitary (internal and External), Site Development works in Existing Langkashi OP under Bordubi PS, Tinsukia District of Assam. (Composite Work)",Works,Open Tender,Item Rate,Composite Works,No,No,NA ,21-Jun-2024 02:00 PM,NA ,120.0,No ,No,Online,19-Jul-2024 02:30 PM,Assam Police Housing Corporation Ltd,Langkashi OP under Bordubi PS in Tinsukia District,786170.0,2.0,"62,73,950",M/S HORIZON ENTERPRISE,"5,552,400",Rejected-Technical,16-Oct-2024,Assam Police Housing Corporation Ltd,"The tender is for the construction of an Assam Type Outpost Building, including civil works, electrical works, sanitary works, and site development works in the existing Langkashi OP under Bordubi PS, Tinsukia District of Assam. The tender does not mention any flood-related keywords or context, and the project scope appears to be a standard building construction rather than a flood-related infrastructure or restoration work. There are no indications of the tender being related to flood protection, prevention, or emergency response. The department involved is the Assam Police Housing Corporation Ltd, which is not typically associated with flood management projects.",Non-Flood,success,
2024_BoTC_35900_1,DPRD/BTC/(6th ASFC)DF/Udl-11/2023/08,Imp of road with EF and SG from Dhonibasti Hemon house to Kundorbil Santipur PWD connecting road under 6th ASFC for the year 2020-21 during 2023-24.,DPRD/BTC/(6th ASFC)DF/Udl-11/2023/08,Works,Open Tender,Item Rate,Civil Works – Roads,No,No,NA ,03-Feb-2024 10:30 AM,NA ,180.0,No ,No,Online,26-Feb-2024 02:30 PM,Bodoland Territorial Council||Panchayat and Rural Development-BTC,Udalguri,784509.0,2.0,"23,76,470",BABUL BAGLARI,"2,376,470",Accepted-AOC,05-Mar-2024,Bodoland Territorial Council||Panchayat and Rural Development-BTC,"The tender is for the improvement of a road with embankment formation and surface grading from Dhonibasti Hemon house to Kundorbil Santipur PWD connecting road under the 6th Assam State Finance Commission (ASFC) for the year 2020-21 during 2023-24. The project is being undertaken by the Bodoland Territorial Council's Panchayat and Rural Development department.

The tender includes keywords related to flood-related infrastructure, such as ""embankment formation"" and ""surface grading"", which are commonly used in flood protection and mitigation projects. Additionally, the project is being carried out under the 6th ASFC, which suggests that it may be part of a larger flood management or disaster response program.

The temporal factor of the project being carried out during the pre-monsoon season also indicates that it may be a flood-related preparatory work.

Based on the presence of flood-related keywords, the project's association with a disaster response program, and the timing of the work, this tender can be classified as a flood-related infrastructure project.",Flood,success,
2024_BoTC_38266_1,DPRD/BTC/(15th FC)Tied-162/2024/7,Installation of 12 Nos Mini Water ATM Machines at BTC Secretariat (Block A and B) and BTCLA Building under Penal Interest of 1st installment of Tied Grant during the year 2021-22 under the Award of 15th FC.,DPRD/BTC/(15th FC)Tied-162/2024/7,Goods,Open Tender,Item Rate,Miscellaneous Goods,No,No,NA ,31-Jul-2024 12:30 PM,NA ,180.0,No ,No,Online,22-Aug-2024 03:00 PM,Bodoland Territorial Council||Panchayat and Rural Development-BTC,BTC Secretariat Complex,783370.0,2.0,"41,88,000",Biddut Chakraborty,"4,187,028",Accepted-AOC,19-Sep-2024,Bodoland Territorial Council||Panchayat and Rural Development-BTC,"The tender is for the installation of 12 mini water ATM machines at the BTC Secretariat and BTCLA Building. This appears to be a standard infrastructure development project rather than a flood-related work. There are no mentions of flood protection, prevention, or flood-related infrastructure like embankments, dykes, or drainage systems. The tender also does not mention any temporal factors like pre-monsoon preparation or post-flood restoration. The department involved is Panchayat and Rural Development, which is not typically associated with flood management. Overall, this tender does not seem to have a primary focus on flood-related activities.",Non-Flood,success,
2024_BoTC_38498_1,BTC/Forest-SOPD/Kok/01/2024/01,"Supply of Tent (Part-II) for forest staffs of various forest divisions, BTC, Kokrajhar under SOPD fund for the year 2024-25","Supply of Tent (Part-II) for forest staffs of various forest divisions, BTC, Kokrajhar under SOPD fund for the year 2024-25",Goods,Open Tender,Supply,Supply of Materials,No,No,NA ,13-Aug-2024 05:30 PM,NA ,180.0,No ,No,Online,03-Sep-2024 03:30 PM,Bodoland Territorial Council||Forests-BTC,KOKRAJHAR,783370.0,2.0,"21,69,000",G B Enterprise,"2,169,000",Accepted-AOC,30-Oct-2024,Bodoland Territorial Council||Forests-BTC,"The tender is for the supply of tents for forest staff in various forest divisions under the Bodoland Territorial Council (BTC). While tents can be used for emergency response during floods, the tender does not explicitly mention any flood-related context or purpose. The department involved is Forests-BTC, which suggests this is a regular procurement for the forest department rather than a flood-specific project. There are no keywords or indicators related to flood protection, prevention, or disaster response. The tender also lacks any temporal factors or urgency that would suggest it is a pre-monsoon or post-flood restoration work.",Non-Flood,success,
2024_BoTC_38500_1,BTC/Forest-SOPD/Kok/01/2024/02,"Supply of Uniform Trousers for forest staffs of various forest divisions, BTC, Kokrajhar under SOPD fund for the year 2024-25","Supply of Uniform Trousers for forest staffs of various forest divisions, BTC, Kokrajhar under SOPD fund for the year 2024-25",Goods,Open Tender,Supply,Uniforms/Curtains/Clothes,No,No,NA ,13-Aug-2024 05:30 PM,NA ,180.0,No ,No,Online,03-Sep-2024 03:30 PM,Bodoland Territorial Council||Forests-BTC,KOKRAJHAR,783370.0,2.0,"41,36,550",G B Enterprise,"4,136,550",Accepted-AOC,30-Oct-2024,Bodoland Territorial Council||Forests-BTC,"The tender is for the supply of uniform trousers for forest staff in various forest divisions under the Bodoland Territorial Council (BTC). This does not appear to be a flood-related project, as the description does not mention any flood protection, prevention, or restoration work. The tender is also not related to flood-related infrastructure, emergency response facilities, or drainage systems in flood-prone areas. The department involved is the Forests-BTC, which is not typically associated with flood management. There are no flood-related keywords or context present in the tender details.",Non-Flood,success,
2024_BoTC_38501_1,BTC/Forest-SOPD/Kok/01/2024/03,"Supply of Torch Light for forest staffs of various forest divisions, BTC, Kokrajhar under SOPD fund for the year 2024-25","Supply of Torch Light for forest staffs of various forest divisions, BTC, Kokrajhar under SOPD fund for the year 2024-25",Goods,Open Tender,Supply,Electronics Equipment,No,No,NA ,13-Aug-2024 06:00 PM,NA ,180.0,No ,No,Online,03-Sep-2024 03:30 PM,Bodoland Territorial Council||Forests-BTC,Kokrajhar,783370.0,2.0,"52,67,500",G B Enterprise,"5,267,500",Accepted-AOC,30-Oct-2024,Bodoland Territorial Council||Forests-BTC,"The tender is for the supply of torchlight for forest staff in various forest divisions under the Bodoland Territorial Council (BTC). It does not mention any flood-related works or infrastructure. The tender is not focused on flood protection, prevention, or restoration. There are no keywords or context indicating that this is a flood-related project. The department involved is Forests-BTC, which is not typically associated with flood management. Overall, this tender appears to be for a routine procurement of equipment for forest staff and does not have a primary focus on flood-related activities.",Non-Flood,success,
2024_BoTC_38504_1,BTC/Forest-SOPD/Kok/01/2024/04,"Supply of Sleeping Bag (Part-I) for forest staffs of various forest divisions, BTC, Kokrajhar under SOPD fund for the year 2024-25","Supply of Sleeping Bag (Part-I) for forest staffs of various forest divisions, BTC, Kokrajhar under SOPD fund for the year 2024-25",Goods,Open Tender,Supply,Supply of Materials,No,No,NA ,13-Aug-2024 06:00 PM,NA ,180.0,No ,No,Online,03-Sep-2024 06:30 PM,Bodoland Territorial Council||Forests-BTC,KOKRAJHAR,783370.0,2.0,"58,80,000",G B Enterprise,"5,880,000",Accepted-AOC,30-Oct-2024,Bodoland Territorial Council||Forests-BTC,"The tender is for the supply of sleeping bags for forest staff in various forest divisions under the Bodoland Territorial Council (BTC). It does not mention any flood-related works or infrastructure. The tender is not focused on flood protection, prevention, or restoration, and there are no keywords or context indicating a flood-related project. The department involved is the Forests-BTC, which is not typically associated with flood management. Overall, this tender appears to be for a routine procurement of supplies for forest staff and does not have a primary focus on flood-related activities.",Non-Flood,success,
2024_BoTC_38505_1,BTC/Forest-SOPD/Kok/01/2024/05,"Supply of Sleeping Bag (Part-II) for forest staffs of various forest divisions, BTC, Kokrajhar under SOPD fund for the year 2024-25","Supply of Sleeping Bag (Part-II) for forest staffs of various forest divisions, BTC, Kokrajhar under SOPD fund for the year 2024-25",Goods,Open Tender,Supply,Supply of Materials,No,No,NA ,13-Aug-2024 06:00 PM,NA ,180.0,No ,No,Online,03-Sep-2024 03:30 PM,Bodoland Territorial Council||Forests-BTC,KOKRAJHAR,783370.0,2.0,"46,62,000",G B Enterprise,"4,662,000",Accepted-AOC,30-Oct-2024,Bodoland Territorial Council||Forests-BTC,"The tender is for the supply of sleeping bags for forest staff in various forest divisions under the Bodoland Territorial Council (BTC). It does not mention any flood-related works or infrastructure. The tender is not focused on flood protection, prevention, or restoration, and there are no keywords or context indicating a flood-related project. The department involved is the Forests-BTC, which is not typically associated with flood management. Overall, this tender appears to be for a routine procurement of supplies for forest staff and does not have a primary focus on flood-related activities.",Non-Flood,success,
2024_BoTC_38532_1,JDB/15th-FC/VI/6/2023-24/7937,Const. of road with E/F and S/G from Bathou Mandir to Dharmeswar Boro house at Thaijoguri village under Jalah Dev. Block in Baksa Dist,Const. of road with E/F and S/G from Bathou Mandir to Dharmeswar Boro house at Thaijoguri village under Jalah Dev. Block in Baksa Dist,Works,Open Tender,Item Rate,Civil Works,No,No,NA ,17-Aug-2024 06:15 PM,NA ,180.0,No ,No,Online,07-Sep-2024 02:30 PM,Bodoland Territorial Council||Panchayat and Rural Development-BTC||Jalah Development Block,JALAH DEVELOPMENT BLOCK JALAHGHAT,781327.0,2.0,"21,00,000",Pradip Narzary,"2,079,211",Rejected-AOC,13-Sep-2024,Bodoland Territorial Council||Panchayat and Rural Development-BTC||Jalah Development Block,"The tender is for the construction of a road with embankment, flood and surface drainage from Bathou Mandir to Dharmeswar Boro house at Thaijoguri village under Jalah Development Block in Baksa District. The key flood-related elements in this tender are the construction of embankment and drainage systems, which are primary indicators of flood-related infrastructure projects. Additionally, the location is mentioned to be under the Jalah Development Block, which suggests that the area is prone to flooding and requires such flood mitigation measures. The department involved, Bodoland Territorial Council and Panchayat and Rural Development, further reinforces the likelihood of this being a flood-related project.",Flood,success,
2024_BoTC_38551_1,DHS/BTC/E-TENDER/2024-25/04,DHS/BTC/E-TENDER/2024-25/04,"Procurement of Surgical item and other related materials for consumption in different health institutions in BTR for financial year 2024-25 2. Procurement of Hospital Furniture, Machineries and other related materials for consumption in different",Goods,Open Tender,Supply,Medical Equipments/Waste,No,No,INTERNAL ,20-Aug-2024 10:00 AM,NA ,90.0,No ,No,Online,10-Sep-2024 01:00 PM,Bodoland Territorial Council||Health and Family Welfare-BTC,BTR,783370.0,2.0,"1,03,40,980",WILLIAM NARZARY,"10,340,560",Rejected-Finance,18-Sep-2024,Bodoland Territorial Council||Health and Family Welfare-BTC,"The tender details do not indicate any flood-related works or infrastructure. The description mentions the procurement of surgical items, hospital furniture, and other related materials for different health institutions in the Bodoland Territorial Region (BTR). There are no keywords or context suggesting flood protection, prevention, or mitigation. The tender appears to be for routine procurement of medical and hospital supplies, which is not directly related to flood management or disaster response.",Non-Flood,success,
2024_BoTC_38552_1,DHS/BTC/E-TENDER/2024-25/05,DHS/BTC/E-TENDER/2024-25/05,"Procurement of Dustbin, Linens and other related materials for consumption in different health institutions in BTR for financial year 2024-25.",Goods,Open Tender,Supply,Medical Equipments/Waste,No,No,NA ,20-Aug-2024 10:00 AM,NA ,90.0,No ,No,Online,10-Sep-2024 01:00 PM,Bodoland Territorial Council||Health and Family Welfare-BTC,BTR,783370.0,2.0,"89,88,000",WILLIAM NARZARY,"8,987,000",Rejected-Finance,18-Sep-2024,Bodoland Territorial Council||Health and Family Welfare-BTC,"The tender is for the procurement of general supplies like dustbins, linens, and other materials for health institutions in the Bodoland Territorial Region (BTR). It does not mention any flood-related works, infrastructure, or emergency response. The tender is for routine procurement and does not appear to be specifically focused on flood protection, prevention, or restoration. There are no flood-related keywords or context provided in the tender details.",Non-Flood,success,
2024_BoTC_38553_1,DHS/BTC/E-TENDER/2024-25/06,DHS/BTC/E-TENDER/2024-25/06,Procurement of Diagnostic (RD) Kit for consumption in different health institutions in BTR for financial year 2024-25.,Goods,Open Tender,Supply,Medical Equipments/Waste,No,No,NA ,20-Aug-2024 10:00 AM,NA ,90.0,No ,No,Online,10-Sep-2024 01:00 PM,Bodoland Territorial Council||Health and Family Welfare-BTC,BTR,783370.0,2.0,"1,00,000",WILLIAM NARZARY,"100,000",Rejected-Finance,18-Sep-2024,Bodoland Territorial Council||Health and Family Welfare-BTC,"The tender is for the procurement of diagnostic kits for health institutions in the Bodoland Territorial Region (BTR). It does not mention any flood-related works, infrastructure, or emergency response. The tender is for routine healthcare supplies and does not appear to be related to flood protection, prevention, or mitigation. The department involved is Health and Family Welfare, which is not typically associated with flood management projects.",Non-Flood,success,
2024_BoTC_38561_1,DHS/BTC/E-TENDER/2024-25/10,DHS/BTC/E-TENDER/2024-25/10,Procurement of Hospital machineries and Equipments in different health institutions in BTR under SOPD for financial year 2024-25,Goods,Open Tender,Supply,Medical Equipments/Waste,No,No,NA ,21-Aug-2024 10:00 AM,NA ,90.0,No ,No,Online,12-Sep-2024 01:00 PM,Bodoland Territorial Council||Health and Family Welfare-BTC,BTR,783370.0,2.0,"78,84,000",DADHI BRAHMA,"7,884,000",Accepted-AOC,04-Oct-2024,Bodoland Territorial Council||Health and Family Welfare-BTC,"The tender is for the procurement of hospital machinery and equipment in different health institutions in the Bodoland Territorial Region (BTR) under the Special Opportunity Fund for Development (SOPD) for the financial year 2024-25. The tender does not mention any flood-related works, infrastructure, or emergency response facilities. The description and department involved (Health and Family Welfare-BTC) indicate that this is a regular procurement tender for healthcare equipment and does not have a specific focus on flood-related activities. There are no keywords or context that suggest this tender is related to flood protection, prevention, or mitigation.",Non-Flood,success,
