2024_PWD_35115_26,CE/DEV/TB/707/2023-24/01,MMPPNA_23_24_12 Construction of road from Saukuchi to Agchiya Part-II under Mukhya Mantrir Pakipath Nirman Achani for the year 2023-24,MMPPNA_23_24_12 Construction of road from Saukuchi to Agchiya Part-II under Mukhya Mantrir Pakipath Nirman Achani for the year 2023-24,Works,Open Tender,Item Rate,Civil Works,No,No,NA ,02-Jan-2024 03:00 PM,04-Jan-2024 12:00 PM ,180.0,No ,No,Online,12-Jan-2024 02:30 PM,Public Works Roads Department,Baksa,781003.0,2.0,"98,33,000",Detshrang Goyary,"9,166,700",Accepted-AOC,19-Oct-2024,Public Works Roads Department,"The tender is for the construction of a road from Saukuchi to Agchiya under the Mukhya Mantrir Pakipath Nirman Achani (Chief Minister's Road Construction Scheme) for the year 2023-24. The project is being undertaken by the Public Works Roads Department, which is a general infrastructure department and not specifically focused on flood management. The tender does not mention any flood-related keywords or context, such as flood protection, embankment construction, or drainage systems in flood-prone areas. Additionally, the tender does not provide any information about the project's timing or urgency, which could indicate a pre-monsoon or post-flood restoration work. Therefore, based on the available information, this tender appears to be for a regular road construction project and not specifically related to flood management or mitigation.",Non-Flood,success,
2024_PWD_35225_1,T/NDTRD/NIT/2022/835,Nalbari/MMPNA/2023-24/05,"Periodic Renewal of 6 metre span RCC slab culvert on Ghagrapar Tamulpur Road under Mukhya Mantri Path Nabikaran Aachani for the year 2023-24 under PWRD, Nalbari District Territorial Road Division in Nalbari LAC",Works,Open Tender,Item Rate,Civil Works – Roads,No,No,NA ,06-Jan-2024 10:00 AM,NA ,180.0,No ,No,Online,17-Jan-2024 10:00 AM,Public Works Roads Department,Nalbari,781335.0,2.0,,SAURABH TALUKDAR,"2,997,272.9",Rejected-AOC,12-Feb-2024,Public Works Roads Department,"The tender is for the periodic renewal of a 6-meter span RCC slab culvert on the Ghagrapar Tamulpur Road under the Mukhya Mantri Path Nabikaran Aachani program for the year 2023-24. The work is being carried out by the Public Works Roads Department (PWRD) in the Nalbari district. While the tender does not explicitly mention flood-related keywords, the context of the project suggests that it is likely related to flood management and infrastructure reinforcement in a flood-prone area. The periodic renewal of a culvert, which is a key component of a drainage system, indicates that the project is intended to improve the area's resilience to flooding. Additionally, the timing of the work, which is scheduled for the pre-monsoon period, further supports the flood-related nature of the project.",Flood,success,
2024_PWD_35402_118,CE/DEV/TB/707/2023-24/04,MMPPNA_23_24_291 (i) Construction of Road and Both Side Covered Drain at Saratpally Starting from Renu Singh petrol Pump to Pratap Das house via Saratpally Bazar with one box culvert near Tri-junction of Saratpally Bazar Ch. 0.00m to Ch. 1000.00m),MMPPNA_23_24_291 (i) Construction of Road and Both Side Covered Drain at Saratpally Starting from Renu Singh petrol Pump to Pratap Das house via Saratpally Bazar with one box culvert near Tri-junction of Saratpally Bazar Ch. 0.00m to Ch. 1000.00m),Works,Open Tender,Item Rate,Civil Works,No,No,NA ,18-Jan-2024 05:55 PM,20-Jan-2024 12:00 PM ,180.0,No ,No,Online,30-Jan-2024 02:30 PM,Public Works Roads Department,Cachar,781003.0,2.0,"3,71,24,000",SRI AMBARISH ROY,"37,911,980",Rejected-Finance,24-Oct-2024,Public Works Roads Department,"The tender describes the construction of a road and covered drains in the Saratpally area, with a box culvert near the tri-junction of Saratpally Bazar. While the project involves drainage infrastructure, there is no explicit mention of it being a flood-related or flood-prevention work. The tender does not provide any information about the project being part of a larger flood management or disaster response initiative. Additionally, the tender does not specify any temporal factors like pre-monsoon preparation or post-flood restoration. Based on the available information, the primary purpose of the project appears to be general infrastructure development and improvement of connectivity in the area, rather than a direct flood-related intervention.",Non-Flood,success,
2024_PWD_35402_125,CE/DEV/TB/707/2023-24/04,"MMPPNA_23_24_313 (i) Construction of Major Bill Namghar to 1 No. Tiloijan Raod from Ch. 0.00 m to Ch. 950.00 m, (ii) Construction of 1. No. Gondhia Road from Ch. 0.00 km to Ch. 1.00 km under Mukhya Mantrir Pakipath Nirman Achani","MMPPNA_23_24_313 (i) Construction of Major Bill Namghar to 1 No. Tiloijan Raod from Ch. 0.00 m to Ch. 950.00 m, (ii) Construction of 1. No. Gondhia Road from Ch. 0.00 km to Ch. 1.00 km under Mukhya Mantrir Pakipath Nirman Achani",Works,Open Tender,Item Rate,Civil Works,No,No,NA ,18-Jan-2024 06:55 PM,20-Jan-2024 12:00 PM ,180.0,No ,No,Online,30-Jan-2024 02:30 PM,Public Works Roads Department,Dibrugarh,781003.0,2.0,"1,71,65,000",MONURANJAN KONWAR,"17,922,900",Accepted-AOC,07-Oct-2024,Public Works Roads Department,"The tender details indicate that this project is for the construction of roads, specifically the ""Major Bill Namghar to 1 No. Tiloijan Road"" and the ""1. No. Gondhia Road"". While the tender mentions that these works are under the ""Mukhya Mantrir Pakipath Nirman Achani"" (Chief Minister's Road Construction Scheme), there are no explicit references to flood-related infrastructure, flood protection, or flood mitigation measures. The tender does not provide any information about the project's location or the specific flood-prone nature of the area. Additionally, the tender does not mention any temporal factors such as pre-monsoon preparation or post-flood restoration. Based on the available information, this tender appears to be for regular road construction and maintenance, rather than a flood-related project.",Non-Flood,success,
2024_PWD_35402_148,CE/DEV/TB/707/2023-24/04,"MMPPNA_23_24_253, Construction of Balijonia Era Gaon Road (Balance portion) from Ch0.00 KM to 1.70 KM under Mukhya Mantrir Pakipath Nirman Achani for the year 2023-24","MMPPNA_23_24_253, Construction of Balijonia Era Gaon Road (Balance portion) from Ch0.00 KM to 1.70 KM under Mukhya Mantrir Pakipath Nirman Achani for the year 2023-24",Works,Open Tender,Item Rate,Civil Works,No,No,NA ,19-Jan-2024 10:30 AM,20-Jan-2024 12:00 PM ,180.0,No ,No,Online,30-Jan-2024 02:30 PM,Public Works Roads Department,Jorhat,781003.0,2.0,"1,14,83,000",Sri Raj Baruah,"10,717,700",Rejected-AOC,23-Oct-2024,Public Works Roads Department,"The tender is for the construction of a road, specifically the Balijonia Era Gaon Road (Balance portion) from Ch0.00 KM to 1.70 KM, under the Mukhya Mantrir Pakipath Nirman Achani (Chief Minister's Road Construction Scheme) for the year 2023-24. The project is being undertaken by the Public Works Roads Department. While the tender does not explicitly mention flood-related works, the location and the fact that it is part of a larger road construction scheme suggest that it may be in a flood-prone area or aimed at improving connectivity and access during flood events. However, the tender does not provide enough information to determine if the primary purpose is flood-related infrastructure or general road development. Therefore, the classification is ambiguous.",Ambiguous,success,
2024_PWD_35744_32,CE/DEV/TB/906/2023-24/01,SOPD_ODS_23_24_13 Construction of (i) Ahubari Road in Pavoi Tea Estate (ii) Road From Sadharu LP School New colony Link Road under SOPD-ODS (Tea Garden Road) for the year 2023-24,SOPD_ODS_23_24_13 Construction of (i) Ahubari Road in Pavoi Tea Estate (ii) Road From Sadharu LP School New colony Link Road under SOPD-ODS (Tea Garden Road) for the year 2023-24,Works,Open Tender,Item Rate,Civil Works,No,No,NA ,03-Feb-2024 05:00 PM,05-Feb-2024 12:00 PM ,180.0,No ,No,Online,13-Feb-2024 02:00 PM,Public Works Roads Department,Biswanath,781003.0,2.0,"1,75,49,000",Sri Diganta Borthakur,"15,794,100",Rejected-AOC,15-Oct-2024,Public Works Roads Department,"The tender is for the construction of two roads in the Pavoi Tea Estate and the Sadharu LP School New colony area under the SOPD-ODS (Tea Garden Road) program for the year 2023-24. The tender does not mention any flood-related keywords or context, such as flood protection, embankment construction, or drainage systems in flood-prone areas. The project appears to be a regular road construction and improvement initiative, without a specific focus on flood mitigation or management. The department involved is the Public Works Roads Department, which suggests a general infrastructure development purpose rather than a flood-related one. Overall, there is no clear indication that this tender is directly related to flood-related infrastructure or emergency response.",Non-Flood,success,
2024_PWD_35744_33,CE/DEV/TB/906/2023-24/01,SOPD_ODS_23_24_14 Construction of road from 4- Lane to Lengri TE including the labour line roads by providing ICBP IN Tea Garden area under SOPD-ODS (Tea Garden Road) for the year 2023-24,SOPD_ODS_23_24_14 Construction of road from 4- Lane to Lengri TE including the labour line roads by providing ICBP IN Tea Garden area under SOPD-ODS (Tea Garden Road) for the year 2023-24,Works,Open Tender,Item Rate,Civil Works,No,No,NA ,03-Feb-2024 05:00 PM,05-Feb-2024 12:00 PM ,180.0,No ,No,Online,13-Feb-2024 02:00 PM,Public Works Roads Department,Karbi Anglong,781003.0,2.0,"2,91,44,000",Sri Girin Chutia,"29,143,357",Rejected-Technical,28-Oct-2024,Public Works Roads Department,"The tender is for the construction of a road from 4-Lane to Lengri TE, including the labor line roads, by providing ICBP (Interlocking Concrete Block Paving) in a Tea Garden area under the SOPD-ODS (Tea Garden Road) program for the year 2023-24. The project is being undertaken by the Public Works Roads Department, and there are no explicit mentions of flood-related keywords or context. The tender appears to be for regular road construction and maintenance work, rather than specific flood-related infrastructure or emergency response. There is no indication of the project being a pre-monsoon preparation or post-flood restoration work.",Non-Flood,success,
2024_PWD_35744_51,CE/DEV/TB/906/2023-24/01,SOPD_ODS_23_24_47 Construction of ICBP road from Mornoi TE Factory to D.K Road (Tama Line) under SOPD-ODS (Tea Garden Road) for the year 2023-24,SOPD_ODS_23_24_47 Construction of ICBP road from Mornoi TE Factory to D.K Road (Tama Line) under SOPD-ODS (Tea Garden Road) for the year 2023-24,Works,Open Tender,Item Rate,Civil Works,No,No,NA ,03-Feb-2024 05:00 PM,05-Feb-2024 12:00 PM ,180.0,No ,No,Online,13-Feb-2024 02:00 PM,Public Works Roads Department,Kokrajhar,781003.0,2.0,"1,03,38,000",TAMESWAR BASUMATARY,"10,336,585",Rejected-AOC,03-Oct-2024,Public Works Roads Department,"The tender is for the construction of an ICBP (Interlocking Concrete Block Pavement) road from Mornoi TE Factory to D.K Road (Tama Line) under the SOPD-ODS (Tea Garden Road) program for the year 2023-24. The project is being undertaken by the Public Works Roads Department, and there are no explicit mentions of flood-related keywords or context in the tender details provided.

While road construction projects can sometimes be related to flood mitigation or management, such as improving drainage or reinforcing infrastructure in flood-prone areas, this tender does not seem to have a primary focus on flood-related work. The description suggests a regular road construction project, likely to improve connectivity and accessibility in the area, rather than a specific flood protection or prevention measure.

Additionally, the tender does not mention any temporal factors, such as pre-monsoon preparation or post-flood restoration, that would indicate a flood-related context. The project also appears to be a planned, routine infrastructure development work rather than an emergency response or flood-specific initiative.",Non-Flood,success,
2024_PWD_35744_61,CE/DEV/TB/906/2023-24/01,SOPD_ODS_23_24_55 Improvement of Tea Garden Road at Khowang TE (Length 1.48 Km) under SOPD-ODS (Tea Garden Road) for the year 2023-24.,SOPD_ODS_23_24_55 Improvement of Tea Garden Road at Khowang TE (Length 1.48 Km) under SOPD-ODS (Tea Garden Road) for the year 2023-24.,Works,Open Tender,Item Rate,Civil Works,No,No,NA ,05-Feb-2024 09:00 AM,05-Feb-2024 12:00 PM ,180.0,No ,No,Online,13-Feb-2024 02:00 PM,Public Works Roads Department,Dibrugarh,781003.0,2.0,"72,85,000",SURAJIT BORUAH,"7,285,000",Rejected-AOC,23-Oct-2024,Public Works Roads Department,"The tender is for the improvement of a Tea Garden Road at Khowang TE under the SOPD-ODS (Tea Garden Road) program. While the tender mentions the length of the road as 1.48 km, it does not provide any explicit information about flood-related works or infrastructure. The tender is also not associated with any specific season, indicating it is likely a planned, routine infrastructure project rather than an emergency flood response or pre-monsoon preparation work. The department involved is the Public Works Roads Department, which suggests the focus is on general road maintenance and improvement rather than flood management. Overall, there are no clear primary or secondary indicators that this tender is specifically related to flood protection, prevention, or mitigation.",Non-Flood,success,
2024_PWD_35744_69,CE/DEV/TB/906/2023-24/01,"SOPD_ODS_23_24_67 Construction of Road at Cinnatolliah Tea Estate Area (i) Construction of Purona line to Factory line Road (From Ch.0.00m to Ch.770.00m, L 0.770km), (ii) Construction of Purona line Road (From Ch.0.00m to Ch.552.00m, L 0.552km)","SOPD_ODS_23_24_67 Construction of Road at Cinnatolliah Tea Estate Area (i) Construction of Purona line to Factory line Road (From Ch.0.00m to Ch.770.00m, L 0.770km), (ii) Construction of Purona line Road (From Ch.0.00m to Ch.552.00m, L 0.552km)",Works,Open Tender,Item Rate,Civil Works,No,No,NA ,05-Feb-2024 09:00 AM,05-Feb-2024 12:00 PM ,180.0,No ,No,Online,13-Feb-2024 02:00 PM,Public Works Roads Department,Lakhimpur,781003.0,2.0,"1,13,17,000",Mrinmoy Jyoti Hazarika,"10,185,300",Rejected-AOC,24-Oct-2024,Public Works Roads Department,"The tender is for the construction of roads in the Cinnatolliah Tea Estate area, which includes the construction of Purona line to Factory line Road and Purona line Road. While the tender does not explicitly mention flood-related works, the location being a tea estate area suggests the possibility of the roads being in a flood-prone region. However, the tender does not provide any specific details about flood protection, prevention, or mitigation measures. The project appears to be a regular road construction and improvement initiative, rather than a targeted flood-related infrastructure project. There are no clear flood-related keywords or indicators in the tender details.",Non-Flood,success,
2024_PWD_35744_76,CE/DEV/TB/906/2023-24/01,"SOPD_ODS_23_24_78 Construction of (i) No. 6 Line Link Road No. 2 (Ch. 0.00 m to Ch. 165.00m), (ii) Link Road from No. 6 Line to Line No. 5 (Ch. 0.00 m to Ch. 265.00m) (iii) No. 5 Line Link Road No.1 (Ch. 0.00m to Ch. 275.00m), (iv) No. 1 Khumtai","SOPD_ODS_23_24_78 Construction of (i) No. 6 Line Link Road No. 2 (Ch. 0.00 m to Ch. 165.00m), (ii) Link Road from No. 6 Line to Line No. 5 (Ch. 0.00 m to Ch. 265.00m) (iii) No. 5 Line Link Road No.1 (Ch. 0.00m to Ch. 275.00m), (iv) No. 1 Khumtai",Works,Open Tender,Item Rate,Civil Works,No,No,NA ,06-Feb-2024 09:00 AM,06-Feb-2024 12:00 PM ,180.0,No ,No,Online,13-Feb-2024 02:00 PM,Public Works Roads Department,Charaideo,781003.0,2.0,"70,98,000",ARJUN MALI,"7,098,000",Accepted-AOC,25-Oct-2024,Public Works Roads Department,"The tender details mention the construction of various link roads, including No. 6 Line Link Road No. 2, Link Road from No. 6 Line to Line No. 5, and No. 5 Line Link Road No.1. While these infrastructure projects may have some impact on flood management, the primary purpose appears to be general road construction and development rather than direct flood protection or prevention. The tender does not explicitly mention any flood-related keywords, emergency response, or flood-prone areas. Additionally, the department involved is the Public Works Roads Department, which suggests a focus on regular infrastructure development rather than specialized flood management. Therefore, based on the information provided, this tender is more likely to be a non-flood-related project.",Non-Flood,success,
2024_PWD_35744_77,CE/DEV/TB/906/2023-24/01,"SOPD_ODS_23_24_79 Construction of (i) Bor Line Link Road No.1 (Ch. 0.00 m to Ch. 250.00m), (ii) Bor Line Link Road No. 2 (Ch. 0.00 m to Ch. 250.00m) (iii) Bor Line Link Road No. 3 (Ch. 0.00m to Ch. 382.00m), (iv) Factory Line (Ch. 0.00 m to","SOPD_ODS_23_24_79 Construction of (i) Bor Line Link Road No.1 (Ch. 0.00 m to Ch. 250.00m), (ii) Bor Line Link Road No. 2 (Ch. 0.00 m to Ch. 250.00m) (iii) Bor Line Link Road No. 3 (Ch. 0.00m to Ch. 382.00m), (iv) Factory Line (Ch. 0.00 m to",Works,Open Tender,Item Rate,Civil Works,No,No,NA ,06-Feb-2024 09:00 AM,06-Feb-2024 12:00 PM ,180.0,No ,No,Online,13-Feb-2024 02:00 PM,Public Works Roads Department,Charaideo,781003.0,2.0,"86,69,000",MONURANJAN KONWAR,"8,668,980",Accepted-AOC,07-Oct-2024,Public Works Roads Department,"The tender details do not indicate any flood-related works or infrastructure. The project involves the construction of several link roads and a factory line, which are typical road construction activities. There are no mentions of flood protection, drainage systems, embankments, or other flood-related keywords. The department involved is the Public Works Roads Department, which suggests a focus on general infrastructure development rather than flood management. Based on the information provided, this tender does not appear to be related to flood-related activities.",Non-Flood,success,
2024_PWD_35971_1,T/DRC/MMPPNA/2023-24/1434,MMPPNA_Dal_23-24_1 Construction of road from Kheteswar No 2 to Arimari No 1 Settlement No 1 at Arimari No 3(from Ch. 0.00 km to Ch. 0.980 km) (L- 0.980 km),MMPPNA_Dal_23-24_1 Construction of road from Kheteswar No 2 to Arimari No 1 Settlement No 1 at Arimari No 3(from Ch. 0.00 km to Ch. 0.980 km) (L- 0.980 km),Works,Open Tender,Works,Civil Works,No,No,NA ,06-Feb-2024 02:00 PM,08-Feb-2024 12:00 PM ,180.0,No ,No,Online,16-Feb-2024 01:00 PM,Public Works Roads Department,Mangaldoi,784125.0,2.0,"99,58,000",KULEN HAZARIKA,"9,954,354",Accepted-AOC,29-Oct-2024,Public Works Roads Department,"The tender is for the construction of a road from Kheteswar No 2 to Arimari No 1 Settlement No 1 at Arimari No 3. The description does not mention any flood-related aspects, such as flood protection, flood damage restoration, or flood-related infrastructure. The tender is also not associated with any specific season or emergency response. The department involved is the Public Works Roads Department, which suggests this is a regular road construction project rather than a flood-related one. Overall, there are no clear indicators that this tender is related to flood management or mitigation.",Non-Flood,success,
2024_PWD_36041_9,CE/DEV/TB/707/2023-24/18,"MMPPNA_23_24_309 (i) Construction of Road from Balichapori Majgaon connecting Road from Ch. 0.00 km to 0.855 km (L 0.855 km), (ii) Construction of Bojou Ali from Ch. 0.00 km to 1.04 km (L 1.04 km), (iii) Construction of Jonai Chuk Road from","MMPPNA_23_24_309 (i) Construction of Road from Balichapori Majgaon connecting Road from Ch. 0.00 km to 0.855 km (L 0.855 km), (ii) Construction of Bojou Ali from Ch. 0.00 km to 1.04 km (L 1.04 km), (iii) Construction of Jonai Chuk Road from",Works,Open Tender,Item Rate,Civil Works,No,No,NA ,08-Feb-2024 12:00 PM,08-Feb-2024 02:00 PM ,180.0,No ,No,Online,15-Feb-2024 02:00 PM,Public Works Roads Department,Jorhat,781003.0,2.0,"2,55,69,000",RITURAJ BORGOHAIN,"26,170,111",Accepted-AOC,23-Oct-2024,Public Works Roads Department,"The tender details indicate that this project is for the construction of roads and infrastructure in the Balichapori Majgaon, Bojou Ali, and Jonai Chuk areas. While the description mentions the construction of roads, it does not explicitly state that these are flood-related works or part of any flood protection/mitigation efforts. There are no clear primary indicators such as flood protection structures, drainage systems in flood-prone areas, or emergency response facilities. The tender also does not mention any temporal factors like pre-monsoon preparation or post-flood restoration. Overall, the information provided suggests that this is a regular road construction project rather than a flood-related infrastructure development.",Non-Flood,success,
2024_PWD_36126_1,CS/SOPD-G/FM/11/2023-24/R,CRC-DDTRD-189/R,Improvement of Sijubari Main Road and its Bye lane connecting Bishnujyoti Path including Drain works for Mitigation of Flood for the year 2023-24. (RETENDER).,Works,Open Tender,Works,Civil Works,No,No,NA ,10-Feb-2024 10:00 AM,NA ,180.0,No ,No,Online,14-Feb-2024 02:00 PM,Public Works Roads Department,Kamrup,781021.0,2.0,"1,01,87,000",ARNAB BHATTACHARJEE,"9,168,300",Accepted-AOC,01-Oct-2024,Public Works Roads Department,"The tender description explicitly mentions ""Improvement of Sijubari Main Road and its Bye lane connecting Bishnujyoti Path including Drain works for Mitigation of Flood for the year 2023-24"". This indicates that the primary purpose of the project is flood mitigation and prevention through infrastructure improvements, including drainage works. The tender is also a re-tender, suggesting the urgency of the flood-related works. The department involved is the Public Works Roads Department, which is responsible for flood-related infrastructure projects. Overall, the tender details strongly suggest that this is a flood-related project.",Flood,success,
2024_PWD_36165_1,CE/DEV/TB/1124/2023-24/02,SOPD_G_23_24_58 Widening and Strengthening of Old NT Road at Kamalpur from Ch. 0.00m to Ch. 1840.00m including construction of Br. No. 2/1 at Ch. 1470.00 m of Span (1 21.75)m and Welcome Gate at Kamalpur under SOPD(G) for the year 2023-24,SOPD_G_23_24_58 Widening and Strengthening of Old NT Road at Kamalpur from Ch. 0.00m to Ch. 1840.00m including construction of Br. No. 2/1 at Ch. 1470.00 m of Span (1 21.75)m and Welcome Gate at Kamalpur under SOPD(G) for the year 2023-24,Works,Open Tender,Works,Civil Works,No,No,NA ,10-Feb-2024 06:00 PM,22-Feb-2024 12:00 PM ,180.0,No ,No,Online,01-Mar-2024 02:00 PM,Public Works Roads Department,Kamrup,781003.0,2.0,"12,51,21,000",D. A. CONSTRUCTION,"125,121,000",Accepted-AOC,19-Oct-2024,Public Works Roads Department,"The tender is for the widening and strengthening of an existing road, including the construction of a bridge and a welcome gate, under the SOPD(G) scheme for the year 2023-24. While the tender mentions the location as Kamalpur, it does not explicitly state that the project is in a flood-prone area or that it is specifically for flood-related infrastructure or damage restoration. The tender also does not mention any flood protection, prevention, or emergency response measures. The project appears to be a regular road infrastructure development work, rather than a flood-related project.",Non-Flood,success,
2024_PWD_36256_8,CE/Maint/MMPNA/01/2023-24/25,MMPNA/2023-24/15,"VMMPNA/2023-24/15_Periodic Renewal of Road from Patia Pukhuri to Amguri Road (Ch 6000.00m to 9000.00m), NH 15 to Borati gaon road (Ch 0.00m to 1300.00m), NH-15 at Rubbertola to Bhangamandir (Ch 0.00m to 4000.00m) and Barchalla tiniali to Gosaighat (C",Works,Open Tender,Item Rate,Civil Works – Roads,No,No,NA ,14-Feb-2024 02:00 PM,15-Feb-2024 12:00 PM ,180.0,No ,No,Online,21-Feb-2024 03:00 PM,Public Works Roads Department,Barchalla,781003.0,2.0,"1,20,75,000",M/S AMINA ENTERPRISE,"12,070,000",Accepted-AOC,14-Oct-2024,Public Works Roads Department,"The tender describes periodic renewal and maintenance works for several road sections, including from Patia Pukhuri to Amguri Road, NH 15 to Borati gaon road, NH-15 at Rubbertola to Bhangamandir, and Barchalla tiniali to Gosaighat. While the tender mentions some road sections that may be prone to flooding, the primary purpose appears to be routine road maintenance and repair rather than specific flood protection or mitigation measures. There are no explicit references to flood-related infrastructure, emergency response, or drainage systems in flood-prone areas. The tender also does not mention any temporal factors like pre-monsoon preparation or post-flood restoration. Overall, the tender seems to be focused on general road infrastructure upkeep rather than flood-related works.",Non-Flood,success,
